"Orthogroup","Amblyomma_aureolatum","Rhipicephalus_bursa","Rhipicephalus_microplus","Rhipicephalus_sanguineus","Rhipicephalus_zambeziensis"
"OG0001023","sp|P34528|YM67_CAEEL Putative serine protease K12H4.7 OS=Caenorhabditis elegans OX=6239 GN=K12H4.7 PE=3 SV=2","tr|A0A023GG53|A0A023GG53_AMBTT Putative thymus-specific serine protease OS=Amblyomma triste OX=251400 PE=2 SV=1, tr|V5IJN1|V5IJN1_IXORI Putative hydrolytic enzyme of the alpha/beta hydrolase fold _Fragment_ OS=Ixodes ricinus OX=34613 PE=2 SV=1","tr|A0A224Z7T1|A0A224Z7T1_9ACAR Thymus specific serine protease OS=Rhipicephalus zambeziensis OX=60191 PE=3 SV=1, tr|A0A224Z7T1|A0A224Z7T1_9ACAR Thymus specific serine protease OS=Rhipicephalus zambeziensis OX=60191 PE=3 SV=1","sp|P34528|YM67_CAEEL Putative serine protease K12H4.7 OS=Caenorhabditis elegans OX=6239 GN=K12H4.7 PE=3 SV=2","sp|P34528|YM67_CAEEL Putative serine protease K12H4.7 OS=Caenorhabditis elegans OX=6239 GN=K12H4.7 PE=3 SV=2"
"OG0001045","sp|Q26474|LACH_SCHAM Lachesin OS=Schistocerca americana OX=7009 GN=LAC PE=1 SV=1","tr|A0A023GN31|A0A023GN31_AMBTT Putative lachesin OS=Amblyomma triste OX=251400 PE=2 SV=1, tr|L7M018|L7M018_RHIPC Putative lachesin OS=Rhipicephalus pulchellus OX=72859 PE=2 SV=1","tr|L7M018|L7M018_RHIPC Putative lachesin OS=Rhipicephalus pulchellus OX=72859 PE=2 SV=1, tr|L7M018|L7M018_RHIPC Putative lachesin OS=Rhipicephalus pulchellus OX=72859 PE=2 SV=1","sp|Q26474|LACH_SCHAM Lachesin OS=Schistocerca americana OX=7009 GN=LAC PE=1 SV=1","sp|Q26474|LACH_SCHAM Lachesin OS=Schistocerca americana OX=7009 GN=LAC PE=1 SV=1"
"OG0001047","sp|Q15404|RSU1_HUMAN Ras suppressor protein 1 OS=Homo sapiens OX=9606 GN=RSU1 PE=1 SV=3","tr|L7LSA9|L7LSA9_RHIPC Putative ras suppressor protein OS=Rhipicephalus pulchellus OX=72859 PE=2 SV=1, tr|L7M660|L7M660_RHIPC Uncharacterized protein OS=Rhipicephalus pulchellus OX=72859 PE=2 SV=1","tr|L7M660|L7M660_RHIPC Uncharacterized protein OS=Rhipicephalus pulchellus OX=72859 PE=2 SV=1, tr|L7M660|L7M660_RHIPC Uncharacterized protein OS=Rhipicephalus pulchellus OX=72859 PE=2 SV=1","sp|Q5E9C0|RSU1_BOVIN Ras suppressor protein 1 OS=Bos taurus OX=9913 GN=RSU1 PE=2 SV=1","sp|Q5E9C0|RSU1_BOVIN Ras suppressor protein 1 OS=Bos taurus OX=9913 GN=RSU1 PE=2 SV=1"
"OG0001048","sp|Q6PD03|2A5A_MOUSE Serine/threonine-protein phosphatase 2A 56 kDa regulatory subunit alpha isoform OS=Mus musculus OX=10090 GN=Ppp2r5a PE=1 SV=1","tr|A0A023GKV0|A0A023GKV0_AMBTT Serine/threonine protein phosphatase 2A regulatory subunit OS=Amblyomma triste OX=251400 PE=2 SV=1, tr|L7MJ01|L7MJ01_RHIPC Putative serine/threonine protein phosphatase 2a regulatory subunit _Fragment_ OS=Rhipicephalus pulchellus OX=72859 PE=2 SV=1","tr|L7M3M4|L7M3M4_RHIPC Serine/threonine protein phosphatase 2A regulatory subunit OS=Rhipicephalus pulchellus OX=72859 PE=2 SV=1, tr|L7M3M4|L7M3M4_RHIPC Serine/threonine protein phosphatase 2A regulatory subunit OS=Rhipicephalus pulchellus OX=72859 PE=2 SV=1","sp|Q6PD03|2A5A_MOUSE Serine/threonine-protein phosphatase 2A 56 kDa regulatory subunit alpha isoform OS=Mus musculus OX=10090 GN=Ppp2r5a PE=1 SV=1","sp|Q6PD03|2A5A_MOUSE Serine/threonine-protein phosphatase 2A 56 kDa regulatory subunit alpha isoform OS=Mus musculus OX=10090 GN=Ppp2r5a PE=1 SV=1"
"OG0001049","sp|Q91447|MP2K1_SERCA Dual specificity mitogen-activated protein kinase kinase 1 _Fragment_ OS=Serinus canaria OX=9135 GN=MAP2K1 PE=2 SV=1","tr|L7MG19|L7MG19_RHIPC Putative mitogen activated protein kinase kinase 1 _Fragment_ OS=Rhipicephalus pulchellus OX=72859 PE=2 SV=1","tr|L7MG19|L7MG19_RHIPC Putative mitogen activated protein kinase kinase 1 _Fragment_ OS=Rhipicephalus pulchellus OX=72859 PE=2 SV=1, tr|L7MG19|L7MG19_RHIPC Putative mitogen activated protein kinase kinase 1 _Fragment_ OS=Rhipicephalus pulchellus OX=72859 PE=2 SV=1","sp|P33886|WIS1_SCHPO Protein kinase wis1 OS=Schizosaccharomyces pombe _strain 972 / ATCC 24843_ OX=284812 GN=wis1 PE=1 SV=1, sp|Q91447|MP2K1_SERCA Dual specificity mitogen-activated protein kinase kinase 1 _Fragment_ OS=Serinus canaria OX=9135 GN=MAP2K1 PE=2 SV=1","sp|Q91447|MP2K1_SERCA Dual specificity mitogen-activated protein kinase kinase 1 _Fragment_ OS=Serinus canaria OX=9135 GN=MAP2K1 PE=2 SV=1"
"OG0001051","sp|O76485|CSK2B_SPOFR Casein kinase II subunit beta OS=Spodoptera frugiperda OX=7108 PE=2 SV=1","tr|A0A023GIY6|A0A023GIY6_AMBTT Casein kinase II subunit beta OS=Amblyomma triste OX=251400 PE=2 SV=1, tr|L7M7Z8|L7M7Z8_RHIPC Casein kinase II subunit beta OS=Rhipicephalus pulchellus OX=72859 PE=2 SV=1","tr|V5HM05|V5HM05_IXORI Casein kinase II subunit beta OS=Ixodes ricinus OX=34613 PE=2 SV=1, tr|V5HM05|V5HM05_IXORI Casein kinase II subunit beta OS=Ixodes ricinus OX=34613 PE=2 SV=1","sp|O76485|CSK2B_SPOFR Casein kinase II subunit beta OS=Spodoptera frugiperda OX=7108 PE=2 SV=1","sp|P28021|CSK2B_XENLA Casein kinase II subunit beta OS=Xenopus laevis OX=8355 GN=csnk2b PE=1 SV=1"
"OG0001053","sp|P36609|NCS2_CAEEL Neuronal calcium sensor 2 OS=Caenorhabditis elegans OX=6239 GN=ncs-2 PE=2 SV=2","tr|A0A023GFW2|A0A023GFW2_AMBTT Putative ca2+ sensor ef-hand superfamily OS=Amblyomma triste OX=251400 PE=2 SV=1, tr|L7M798|L7M798_RHIPC Putative ca2+ sensor ef-hand superfamily OS=Rhipicephalus pulchellus OX=72859 PE=2 SV=1","tr|L7M798|L7M798_RHIPC Putative ca2+ sensor ef-hand superfamily OS=Rhipicephalus pulchellus OX=72859 PE=2 SV=1, tr|L7M798|L7M798_RHIPC Putative ca2+ sensor ef-hand superfamily OS=Rhipicephalus pulchellus OX=72859 PE=2 SV=1","sp|P36609|NCS2_CAEEL Neuronal calcium sensor 2 OS=Caenorhabditis elegans OX=6239 GN=ncs-2 PE=2 SV=2","sp|P36609|NCS2_CAEEL Neuronal calcium sensor 2 OS=Caenorhabditis elegans OX=6239 GN=ncs-2 PE=2 SV=2"
"OG0001054","sp|P31319|KAPR_APLCA cAMP-dependent protein kinase regulatory subunit OS=Aplysia californica OX=6500 PE=2 SV=2","tr|A0A023GJA0|A0A023GJA0_AMBTT Putative camp-dependent protein kinase types i and ii regulatory subunit OS=Amblyomma triste OX=251400 PE=2 SV=1, tr|L7MBB2|L7MBB2_RHIPC Uncharacterized protein _Fragment_ OS=Rhipicephalus pulchellus OX=72859 PE=2 SV=1","tr|L7MBB2|L7MBB2_RHIPC Uncharacterized protein _Fragment_ OS=Rhipicephalus pulchellus OX=72859 PE=2 SV=1, tr|L7MBB2|L7MBB2_RHIPC Uncharacterized protein _Fragment_ OS=Rhipicephalus pulchellus OX=72859 PE=2 SV=1","sp|P31319|KAPR_APLCA cAMP-dependent protein kinase regulatory subunit OS=Aplysia californica OX=6500 PE=2 SV=2","sp|P31319|KAPR_APLCA cAMP-dependent protein kinase regulatory subunit OS=Aplysia californica OX=6500 PE=2 SV=2"
"OG0001055","sp|Q58D56|DRG2_BOVIN Developmentally-regulated GTP-binding protein 2 OS=Bos taurus OX=9913 GN=DRG2 PE=2 SV=1","tr|A0A023FKB2|A0A023FKB2_AMBCJ Putative gtp-binding protein drg2 odn superfamily _Fragment_ OS=Amblyomma cajennense OX=34607 PE=2 SV=1, tr|L7MLK1|L7MLK1_RHIPC Putative gtp-binding protein drg1 odn superfamily _Fragment_ OS=Rhipicephalus pulchellus OX=72859 PE=2 SV=1","tr|L7MLK1|L7MLK1_RHIPC Putative gtp-binding protein drg1 odn superfamily _Fragment_ OS=Rhipicephalus pulchellus OX=72859 PE=2 SV=1, tr|L7MLK1|L7MLK1_RHIPC Putative gtp-binding protein drg1 odn superfamily _Fragment_ OS=Rhipicephalus pulchellus OX=72859 PE=2 SV=1","sp|Q58D56|DRG2_BOVIN Developmentally-regulated GTP-binding protein 2 OS=Bos taurus OX=9913 GN=DRG2 PE=2 SV=1","sp|P55039|DRG2_HUMAN Developmentally-regulated GTP-binding protein 2 OS=Homo sapiens OX=9606 GN=DRG2 PE=1 SV=1"
"OG0001057","sp|Q9I7T7|LAR4_DROME La-related protein Larp4B OS=Drosophila melanogaster OX=7227 GN=Larp4B PE=1 SV=2","tr|A0A023G761|A0A023G761_AMBTT Putative proteophosphoglycan ppg4 major strain friedlin proteophosphoglycan ppg4 _Fragment_ OS=Amblyomma triste OX=251400 PE=2 SV=1, tr|L7MKC7|L7MKC7_RHIPC Putative c-mpl binding protein _Fragment_ OS=Rhipicephalus pulchellus OX=72859 PE=2 SV=1","tr|L7MKC7|L7MKC7_RHIPC Putative c-mpl binding protein _Fragment_ OS=Rhipicephalus pulchellus OX=72859 PE=2 SV=1, tr|L7MKC7|L7MKC7_RHIPC Putative c-mpl binding protein _Fragment_ OS=Rhipicephalus pulchellus OX=72859 PE=2 SV=1","sp|Q9I7T7|LAR4_DROME La-related protein Larp4B OS=Drosophila melanogaster OX=7227 GN=Larp4B PE=1 SV=2","sp|Q9I7T7|LAR4_DROME La-related protein Larp4B OS=Drosophila melanogaster OX=7227 GN=Larp4B PE=1 SV=2"
"OG0001062","sp|Q9WV92|E41L3_MOUSE Band 4.1-like protein 3 OS=Mus musculus OX=10090 GN=Epb41l3 PE=1 SV=1","tr|L7LWN1|L7LWN1_RHIPC Moesin/ezrin/radixin homolog 1 OS=Rhipicephalus pulchellus OX=72859 PE=2 SV=1, tr|L7M9D1|L7M9D1_RHIPC Moesin/ezrin/radixin homolog 1 OS=Rhipicephalus pulchellus OX=72859 PE=2 SV=1","tr|L7M9K6|L7M9K6_RHIPC Moesin/ezrin/radixin homolog 1 OS=Rhipicephalus pulchellus OX=72859 PE=2 SV=1, tr|L7M9K6|L7M9K6_RHIPC Moesin/ezrin/radixin homolog 1 OS=Rhipicephalus pulchellus OX=72859 PE=2 SV=1","sp|Q9WV92|E41L3_MOUSE Band 4.1-like protein 3 OS=Mus musculus OX=10090 GN=Epb41l3 PE=1 SV=1","sp|Q9WV92|E41L3_MOUSE Band 4.1-like protein 3 OS=Mus musculus OX=10090 GN=Epb41l3 PE=1 SV=1"
"OG0001064","sp|P80912|HINT1_RABIT Histidine triad nucleotide-binding protein 1 OS=Oryctolagus cuniculus OX=9986 GN=HINT1 PE=1 SV=2","tr|L7M2N8|L7M2N8_RHIPC HIT domain-containing protein OS=Rhipicephalus pulchellus OX=72859 PE=2 SV=1, tr|L7M3Z4|L7M3Z4_RHIPC HIT domain-containing protein OS=Rhipicephalus pulchellus OX=72859 PE=2 SV=1","tr|L7M2N8|L7M2N8_RHIPC HIT domain-containing protein OS=Rhipicephalus pulchellus OX=72859 PE=2 SV=1, tr|L7M2N8|L7M2N8_RHIPC HIT domain-containing protein OS=Rhipicephalus pulchellus OX=72859 PE=2 SV=1","sp|P62958|HINT1_BOVIN Histidine triad nucleotide-binding protein 1 OS=Bos taurus OX=9913 GN=HINT1 PE=1 SV=2","sp|P62958|HINT1_BOVIN Histidine triad nucleotide-binding protein 1 OS=Bos taurus OX=9913 GN=HINT1 PE=1 SV=2"
"OG0001067","sp|Q9WV60|GSK3B_MOUSE Glycogen synthase kinase-3 beta OS=Mus musculus OX=10090 GN=Gsk3b PE=1 SV=2","tr|A0A023GMQ4|A0A023GMQ4_AMBTT Putative glycogen synthase kinase-3 OS=Amblyomma triste OX=251400 PE=2 SV=1, tr|A9P773|A9P773_RHIMP Glycogen synthase kinase OS=Rhipicephalus microplus OX=6941 GN=GSK-3 PE=2 SV=1","tr|A9P773|A9P773_RHIMP Glycogen synthase kinase OS=Rhipicephalus microplus OX=6941 GN=GSK-3 PE=2 SV=1, tr|A9P773|A9P773_RHIMP Glycogen synthase kinase OS=Rhipicephalus microplus OX=6941 GN=GSK-3 PE=2 SV=1","sp|Q91757|GSK3B_XENLA Glycogen synthase kinase-3 beta OS=Xenopus laevis OX=8355 GN=gsk3b PE=1 SV=1","sp|Q5YJC2|GSK3B_SPECI Glycogen synthase kinase-3 beta OS=Spermophilus citellus OX=9997 GN=GSK3B PE=2 SV=1"
"OG0001069","sp|Q71U00|SKP1_XENLA S-phase kinase-associated protein 1 OS=Xenopus laevis OX=8355 GN=skp1 PE=1 SV=3","tr|F0J9W6|F0J9W6_AMBVA SCF ubiquitin ligase Skp1 component OS=Amblyomma variegatum OX=34610 PE=2 SV=1, tr|Q4PM71|Q4PM71_IXOSC Putative scf ubiquitin ligase complex OS=Ixodes scapularis OX=6945 PE=2 SV=1","tr|Q4PM71|Q4PM71_IXOSC Putative scf ubiquitin ligase complex OS=Ixodes scapularis OX=6945 PE=2 SV=1, tr|Q4PM71|Q4PM71_IXOSC Putative scf ubiquitin ligase complex OS=Ixodes scapularis OX=6945 PE=2 SV=1","sp|Q71U00|SKP1_XENLA S-phase kinase-associated protein 1 OS=Xenopus laevis OX=8355 GN=skp1 PE=1 SV=3","sp|Q71U00|SKP1_XENLA S-phase kinase-associated protein 1 OS=Xenopus laevis OX=8355 GN=skp1 PE=1 SV=3"
"OG0001076","sp|A1L2L5|PTCD2_XENLA Pentatricopeptide repeat-containing protein 2_ mitochondrial OS=Xenopus laevis OX=8355 GN=ptcd2 PE=2 SV=1, sp|Q566X6|PTCD2_DANRE Pentatricopeptide repeat-containing protein 2_ mitochondrial OS=Danio rerio OX=7955 GN=ptcd2 PE=2 SV=1","tr|L7LYX6|L7LYX6_RHIPC Uncharacterized protein OS=Rhipicephalus pulchellus OX=72859 PE=2 SV=1","tr|L7LYX6|L7LYX6_RHIPC Uncharacterized protein OS=Rhipicephalus pulchellus OX=72859 PE=2 SV=1, tr|L7LYX6|L7LYX6_RHIPC Uncharacterized protein OS=Rhipicephalus pulchellus OX=72859 PE=2 SV=1","sp|A1L2L5|PTCD2_XENLA Pentatricopeptide repeat-containing protein 2_ mitochondrial OS=Xenopus laevis OX=8355 GN=ptcd2 PE=2 SV=1","sp|Q566X6|PTCD2_DANRE Pentatricopeptide repeat-containing protein 2_ mitochondrial OS=Danio rerio OX=7955 GN=ptcd2 PE=2 SV=1"
"OG0001079","sp|O00567|NOP56_HUMAN Nucleolar protein 56 OS=Homo sapiens OX=9606 GN=NOP56 PE=1 SV=4, sp|Q3SZ63|NOP56_BOVIN Nucleolar protein 56 OS=Bos taurus OX=9913 GN=NOP56 PE=2 SV=1","tr|L7M1R8|L7M1R8_RHIPC Putative ribosome bioproteinsis protein OS=Rhipicephalus pulchellus OX=72859 PE=2 SV=1","tr|L7M1R8|L7M1R8_RHIPC Putative ribosome bioproteinsis protein OS=Rhipicephalus pulchellus OX=72859 PE=2 SV=1, tr|L7M1R8|L7M1R8_RHIPC Putative ribosome bioproteinsis protein OS=Rhipicephalus pulchellus OX=72859 PE=2 SV=1","sp|O00567|NOP56_HUMAN Nucleolar protein 56 OS=Homo sapiens OX=9606 GN=NOP56 PE=1 SV=4","sp|O00567|NOP56_HUMAN Nucleolar protein 56 OS=Homo sapiens OX=9606 GN=NOP56 PE=1 SV=4"
"OG0001080","sp|Q6PFR5|TRA2A_MOUSE Transformer-2 protein homolog alpha OS=Mus musculus OX=10090 GN=Tra2a PE=1 SV=1","tr|A0A023G5S8|A0A023G5S8_AMBTT Putative transformer 2 beta protein OS=Amblyomma triste OX=251400 PE=2 SV=1, tr|L7M5F2|L7M5F2_RHIPC Putative transformer 2 alpha log OS=Rhipicephalus pulchellus OX=72859 PE=2 SV=1","tr|L7M5F2|L7M5F2_RHIPC Putative transformer 2 alpha log OS=Rhipicephalus pulchellus OX=72859 PE=2 SV=1, tr|L7M5F2|L7M5F2_RHIPC Putative transformer 2 alpha log OS=Rhipicephalus pulchellus OX=72859 PE=2 SV=1","sp|P62997|TRA2B_RAT Transformer-2 protein homolog beta OS=Rattus norvegicus OX=10116 GN=Tra2b PE=1 SV=1","sp|P62997|TRA2B_RAT Transformer-2 protein homolog beta OS=Rattus norvegicus OX=10116 GN=Tra2b PE=1 SV=1"
"OG0001090","sp|Q6IP73|NACA_XENLA Nascent polypeptide-associated complex subunit alpha OS=Xenopus laevis OX=8355 GN=naca PE=2 SV=1","tr|A0A023FFS4|A0A023FFS4_AMBCJ Putative transcription factor OS=Amblyomma cajennense OX=34607 PE=2 SV=1","tr|A0A224Z1G8|A0A224Z1G8_9ACAR Transcription factor OS=Rhipicephalus zambeziensis OX=60191 PE=4 SV=1, tr|A0A224Z1G8|A0A224Z1G8_9ACAR Transcription factor OS=Rhipicephalus zambeziensis OX=60191 PE=4 SV=1","sp|P70670|NACAM_MOUSE Nascent polypeptide-associated complex subunit alpha_ muscle-specific form OS=Mus musculus OX=10090 GN=Naca PE=1 SV=2, sp|Q6IP73|NACA_XENLA Nascent polypeptide-associated complex subunit alpha OS=Xenopus laevis OX=8355 GN=naca PE=2 SV=1","sp|Q8AWF2|NACA_ORENI Nascent polypeptide-associated complex subunit alpha OS=Oreochromis niloticus OX=8128 GN=naca PE=2 SV=1"
"OG0001092","sp|Q7KVQ0|GAR1_DROME Probable H/ACA ribonucleoprotein complex subunit 1 OS=Drosophila melanogaster OX=7227 GN=CG4038 PE=2 SV=1, sp|Q7ZVE0|GAR1_DANRE H/ACA ribonucleoprotein complex subunit 1 OS=Danio rerio OX=7955 GN=gar1 PE=2 SV=1","tr|L7M3J7|L7M3J7_RHIPC H/ACA ribonucleoprotein complex subunit OS=Rhipicephalus pulchellus OX=72859 PE=2 SV=1","tr|L7M3J7|L7M3J7_RHIPC H/ACA ribonucleoprotein complex subunit OS=Rhipicephalus pulchellus OX=72859 PE=2 SV=1, tr|L7M3J7|L7M3J7_RHIPC H/ACA ribonucleoprotein complex subunit OS=Rhipicephalus pulchellus OX=72859 PE=2 SV=1","sp|Q5RJV1|GAR1_XENTR H/ACA ribonucleoprotein complex subunit 1 OS=Xenopus tropicalis OX=8364 GN=gar1 PE=2 SV=1","sp|Q5RJV1|GAR1_XENTR H/ACA ribonucleoprotein complex subunit 1 OS=Xenopus tropicalis OX=8364 GN=gar1 PE=2 SV=1"
"OG0001095","sp|Q6PHK6|PURB_DANRE Transcriptional activator protein Pur-beta OS=Danio rerio OX=7955 GN=purb PE=2 SV=3","tr|B7PKC2|B7PKC2_IXOSC Pur-alpha_ putative _Fragment_ OS=Ixodes scapularis OX=6945 GN=8052689 PE=3 SV=1, tr|L7MFW1|L7MFW1_RHIPC Putative transcriptional regulator of the pur family single-stranded-dna-binding protein _Fragment_ OS=Rhipicephalus pulchellus OX=72859 PE=2 SV=1","tr|L7MGB3|L7MGB3_RHIPC Putative transcriptional regulator of the pur family single-stranded-dna-binding protein _Fragment_ OS=Rhipicephalus pulchellus OX=72859 PE=2 SV=1, tr|L7MGB3|L7MGB3_RHIPC Putative transcriptional regulator of the pur family single-stranded-dna-binding protein _Fragment_ OS=Rhipicephalus pulchellus OX=72859 PE=2 SV=1","sp|Q6PHK6|PURB_DANRE Transcriptional activator protein Pur-beta OS=Danio rerio OX=7955 GN=purb PE=2 SV=3","sp|Q00577|PURA_HUMAN Transcriptional activator protein Pur-alpha OS=Homo sapiens OX=9606 GN=PURA PE=1 SV=2"
"OG0001104","sp|Q63396|TCP4_RAT Activated RNA polymerase II transcriptional coactivator p15 OS=Rattus norvegicus OX=10116 GN=Sub1 PE=1 SV=3","tr|A0A023GDN4|A0A023GDN4_AMBTT Putative activated rna polymerase ii transcriptional coactivator p15-like protein OS=Amblyomma triste OX=251400 PE=2 SV=1, tr|L7M357|L7M357_RHIPC Putative activated rna polymerase ii transcriptional coactivator p15-like protein OS=Rhipicephalus pulchellus OX=72859 PE=2 SV=1","tr|L7M357|L7M357_RHIPC Putative activated rna polymerase ii transcriptional coactivator p15-like protein OS=Rhipicephalus pulchellus OX=72859 PE=2 SV=1, tr|L7M357|L7M357_RHIPC Putative activated rna polymerase ii transcriptional coactivator p15-like protein OS=Rhipicephalus pulchellus OX=72859 PE=2 SV=1","sp|Q5ZK63|TCP4_CHICK Activated RNA polymerase II transcriptional coactivator p15 OS=Gallus gallus OX=9031 GN=SUB1 PE=2 SV=1","sp|Q5ZK63|TCP4_CHICK Activated RNA polymerase II transcriptional coactivator p15 OS=Gallus gallus OX=9031 GN=SUB1 PE=2 SV=1"
"OG0001105","sp|P46087|NOP2_HUMAN Probable 28S rRNA _cytosine_4447_-C_5__-methyltransferase OS=Homo sapiens OX=9606 GN=NOP2 PE=1 SV=2","tr|B7PDK8|B7PDK8_IXOSC Nucleolar protein_ putative OS=Ixodes scapularis OX=6945 GN=8028334 PE=3 SV=1, tr|L7LZC8|L7LZC8_RHIPC Putative trna and rrna cytosine-c5-methylase nucleolar protein nol1/nop2 OS=Rhipicephalus pulchellus OX=72859 PE=2 SV=1","tr|L7LZC8|L7LZC8_RHIPC Putative trna and rrna cytosine-c5-methylase nucleolar protein nol1/nop2 OS=Rhipicephalus pulchellus OX=72859 PE=2 SV=1, tr|L7LZC8|L7LZC8_RHIPC Putative trna and rrna cytosine-c5-methylase nucleolar protein nol1/nop2 OS=Rhipicephalus pulchellus OX=72859 PE=2 SV=1","sp|P46087|NOP2_HUMAN Probable 28S rRNA _cytosine_4447_-C_5__-methyltransferase OS=Homo sapiens OX=9606 GN=NOP2 PE=1 SV=2","sp|P46087|NOP2_HUMAN Probable 28S rRNA _cytosine_4447_-C_5__-methyltransferase OS=Homo sapiens OX=9606 GN=NOP2 PE=1 SV=2"
"OG0001106","sp|Q86V81|THOC4_HUMAN THO complex subunit 4 OS=Homo sapiens OX=9606 GN=ALYREF PE=1 SV=3","tr|A0A023GHL9|A0A023GHL9_AMBTT Putative tho complex 4 _Fragment_ OS=Amblyomma triste OX=251400 PE=2 SV=1, tr|L7LZL3|L7LZL3_RHIPC Putative tho complex subunit 4 OS=Rhipicephalus pulchellus OX=72859 PE=2 SV=1","tr|L7LZL3|L7LZL3_RHIPC Putative tho complex subunit 4 OS=Rhipicephalus pulchellus OX=72859 PE=2 SV=1, tr|L7LZL3|L7LZL3_RHIPC Putative tho complex subunit 4 OS=Rhipicephalus pulchellus OX=72859 PE=2 SV=1","sp|Q86V81|THOC4_HUMAN THO complex subunit 4 OS=Homo sapiens OX=9606 GN=ALYREF PE=1 SV=3","sp|Q9JJW6|ALRF2_MOUSE Aly/REF export factor 2 OS=Mus musculus OX=10090 GN=Alyref2 PE=1 SV=1"
"OG0001107","sp|Q9EPU0|RENT1_MOUSE Regulator of nonsense transcripts 1 OS=Mus musculus OX=10090 GN=Upf1 PE=1 SV=2","tr|A0A023GM22|A0A023GM22_AMBTT Putative rna helicase nonsense mrna reducing factor pnorf1 _Fragment_ OS=Amblyomma triste OX=251400 PE=2 SV=1, tr|L7M5Y4|L7M5Y4_RHIPC Uncharacterized protein OS=Rhipicephalus pulchellus OX=72859 PE=2 SV=1","tr|L7M5Y4|L7M5Y4_RHIPC Uncharacterized protein OS=Rhipicephalus pulchellus OX=72859 PE=2 SV=1, tr|L7M5Y4|L7M5Y4_RHIPC Uncharacterized protein OS=Rhipicephalus pulchellus OX=72859 PE=2 SV=1","sp|Q9EPU0|RENT1_MOUSE Regulator of nonsense transcripts 1 OS=Mus musculus OX=10090 GN=Upf1 PE=1 SV=2","sp|Q9EPU0|RENT1_MOUSE Regulator of nonsense transcripts 1 OS=Mus musculus OX=10090 GN=Upf1 PE=1 SV=2"
"OG0001109","sp|Q9UMS4|PRP19_HUMAN Pre-mRNA-processing factor 19 OS=Homo sapiens OX=9606 GN=PRPF19 PE=1 SV=1","tr|A0A023GKT6|A0A023GKT6_AMBTT Pre-mRNA-processing factor 19 OS=Amblyomma triste OX=251400 PE=2 SV=1, tr|L7M8G5|L7M8G5_RHIPC Pre-mRNA-processing factor 19 OS=Rhipicephalus pulchellus OX=72859 PE=2 SV=1","tr|A0A131XGS2|A0A131XGS2_9ACAR Pre-mRNA-processing factor 19 OS=Hyalomma excavatum OX=257692 PE=2 SV=1, tr|A0A131XGS2|A0A131XGS2_9ACAR Pre-mRNA-processing factor 19 OS=Hyalomma excavatum OX=257692 PE=2 SV=1","sp|Q9UMS4|PRP19_HUMAN Pre-mRNA-processing factor 19 OS=Homo sapiens OX=9606 GN=PRPF19 PE=1 SV=1","sp|Q9UMS4|PRP19_HUMAN Pre-mRNA-processing factor 19 OS=Homo sapiens OX=9606 GN=PRPF19 PE=1 SV=1"
"OG0001112","sp|Q5REU4|SND1_PONAB Staphylococcal nuclease domain-containing protein 1 OS=Pongo abelii OX=9601 GN=SND1 PE=2 SV=1","tr|A0A023FLA3|A0A023FLA3_AMBCJ Staphylococcal nuclease domain-containing protein OS=Amblyomma cajennense OX=34607 PE=2 SV=1, tr|A0A023G023|A0A023G023_AMBPA Putative transcriptional coactivator _Fragment_ OS=Amblyomma parvum OX=251391 PE=2 SV=1","tr|A0A224Z8V8|A0A224Z8V8_9ACAR Staphylococcal nuclease domain-containing protein OS=Rhipicephalus zambeziensis OX=60191 PE=4 SV=1, tr|A0A224Z8V8|A0A224Z8V8_9ACAR Staphylococcal nuclease domain-containing protein OS=Rhipicephalus zambeziensis OX=60191 PE=4 SV=1","sp|Q5REU4|SND1_PONAB Staphylococcal nuclease domain-containing protein 1 OS=Pongo abelii OX=9601 GN=SND1 PE=2 SV=1","sp|Q7KZF4|SND1_HUMAN Staphylococcal nuclease domain-containing protein 1 OS=Homo sapiens OX=9606 GN=SND1 PE=1 SV=1"
"OG0001113","sp|O60506|HNRPQ_HUMAN Heterogeneous nuclear ribonucleoprotein Q OS=Homo sapiens OX=9606 GN=SYNCRIP PE=1 SV=2","tr|L7M073|L7M073_RHIPC Putative heteroproteinous nuclear ribonucleoprotein r rrm superfamily OS=Rhipicephalus pulchellus OX=72859 PE=2 SV=1, tr|V5IFA4|V5IFA4_IXORI Putative heteroproteinous nuclear ribonucleoprotein r rrm superfamily _Fragment_ OS=Ixodes ricinus OX=34613 PE=2 SV=1","tr|A0A1E1X8X4|A0A1E1X8X4_9ACAR Putative heteroproteinous nuclear ribonucleoprotein r rrm superfamily OS=Amblyomma aureolatum OX=187763 PE=2 SV=1, tr|A0A1E1X8X4|A0A1E1X8X4_9ACAR Putative heteroproteinous nuclear ribonucleoprotein r rrm superfamily OS=Amblyomma aureolatum OX=187763 PE=2 SV=1","sp|O60506|HNRPQ_HUMAN Heterogeneous nuclear ribonucleoprotein Q OS=Homo sapiens OX=9606 GN=SYNCRIP PE=1 SV=2","sp|O60506|HNRPQ_HUMAN Heterogeneous nuclear ribonucleoprotein Q OS=Homo sapiens OX=9606 GN=SYNCRIP PE=1 SV=2"
"OG0001116","sp|Q8WQA4|EXC4_CAEEL Chloride intracellular channel exc-4 OS=Caenorhabditis elegans OX=6239 GN=exc-4 PE=1 SV=2","tr|A0A023GA12|A0A023GA12_AMBTT Putative chloride channel ixodes scapularis chloride channel OS=Amblyomma triste OX=251400 PE=2 SV=1, tr|L7M5K4|L7M5K4_RHIPC Putative chloride intracellular channel 6-like protein OS=Rhipicephalus pulchellus OX=72859 PE=2 SV=1","tr|L7M5K4|L7M5K4_RHIPC Putative chloride intracellular channel 6-like protein OS=Rhipicephalus pulchellus OX=72859 PE=2 SV=1, tr|L7M5K4|L7M5K4_RHIPC Putative chloride intracellular channel 6-like protein OS=Rhipicephalus pulchellus OX=72859 PE=2 SV=1","sp|Q8WQA4|EXC4_CAEEL Chloride intracellular channel exc-4 OS=Caenorhabditis elegans OX=6239 GN=exc-4 PE=1 SV=2","sp|Q8WQA4|EXC4_CAEEL Chloride intracellular channel exc-4 OS=Caenorhabditis elegans OX=6239 GN=exc-4 PE=1 SV=2"
"OG0001118","sp|Q6MG08|ABCF1_RAT ATP-binding cassette sub-family F member 1 OS=Rattus norvegicus OX=10116 GN=Abcf1 PE=1 SV=1","tr|B7PM08|B7PM08_IXOSC eIF2-interacting protein ABC50_ putative _Fragment_ OS=Ixodes scapularis OX=6945 GN=IscW_ISCW006228 PE=4 SV=1, tr|L7M9X4|L7M9X4_RHIPC Putative transporter abc superfamily OS=Rhipicephalus pulchellus OX=72859 PE=2 SV=1","tr|L7M9X4|L7M9X4_RHIPC Putative transporter abc superfamily OS=Rhipicephalus pulchellus OX=72859 PE=2 SV=1, tr|L7M9X4|L7M9X4_RHIPC Putative transporter abc superfamily OS=Rhipicephalus pulchellus OX=72859 PE=2 SV=1","sp|Q6P542|ABCF1_MOUSE ATP-binding cassette sub-family F member 1 OS=Mus musculus OX=10090 GN=Abcf1 PE=1 SV=1","sp|Q767L0|ABCF1_PIG ATP-binding cassette sub-family F member 1 OS=Sus scrofa OX=9823 GN=ABCF1 PE=3 SV=1"
"OG0001119","sp|Q9U5N1|VATC_MANSE V-type proton ATPase subunit C OS=Manduca sexta OX=7130 PE=2 SV=1","tr|A0A023GJJ0|A0A023GJJ0_AMBTT V-type proton ATPase subunit C OS=Amblyomma triste OX=251400 PE=2 SV=1, tr|L7M7S4|L7M7S4_RHIPC V-type proton ATPase subunit C OS=Rhipicephalus pulchellus OX=72859 PE=2 SV=1","tr|A0A224Z7R3|A0A224Z7R3_9ACAR V-type proton ATPase subunit C OS=Rhipicephalus zambeziensis OX=60191 PE=3 SV=1, tr|A0A224Z7R3|A0A224Z7R3_9ACAR V-type proton ATPase subunit C OS=Rhipicephalus zambeziensis OX=60191 PE=3 SV=1","sp|Q9U5N1|VATC_MANSE V-type proton ATPase subunit C OS=Manduca sexta OX=7130 PE=2 SV=1","sp|Q9U5N1|VATC_MANSE V-type proton ATPase subunit C OS=Manduca sexta OX=7130 PE=2 SV=1"
"OG0001120","sp|P25169|AT1B1_ARTSF Sodium/potassium-transporting ATPase subunit beta OS=Artemia franciscana OX=6661 PE=2 SV=1","tr|A0A023GE75|A0A023GE75_AMBTT Putative sodium/potassium-transporting atpase subunit beta OS=Amblyomma triste OX=251400 PE=2 SV=1, tr|A0A023GHE3|A0A023GHE3_AMBTT Putative sodium/potassium-transporting atpase subunit beta OS=Amblyomma triste OX=251400 PE=2 SV=1","tr|A0A224Z4T4|A0A224Z4T4_9ACAR Sodium/potassium-transporting ATPase subunit beta OS=Rhipicephalus zambeziensis OX=60191 PE=3 SV=1, tr|A0A224Z4T4|A0A224Z4T4_9ACAR Sodium/potassium-transporting ATPase subunit beta OS=Rhipicephalus zambeziensis OX=60191 PE=3 SV=1","sp|P25169|AT1B1_ARTSF Sodium/potassium-transporting ATPase subunit beta OS=Artemia franciscana OX=6661 PE=2 SV=1","sp|P25169|AT1B1_ARTSF Sodium/potassium-transporting ATPase subunit beta OS=Artemia franciscana OX=6661 PE=2 SV=1"
