"Orthogroup","Amblyomma_aureolatum","Rhipicephalus_bursa","Rhipicephalus_microplus","Rhipicephalus_sanguineus","Rhipicephalus_zambeziensis"
"OG0000005","sp|P29508|SPB3_HUMAN Serpin B3 OS=Homo sapiens OX=9606 GN=SERPINB3 PE=1 SV=2, sp|P48594|SPB4_HUMAN Serpin B4 OS=Homo sapiens OX=9606 GN=SERPINB4 PE=1 SV=2, sp|P80229|ILEU_PIG Leukocyte elastase inhibitor OS=Sus scrofa OX=9823 GN=SERPINB1 PE=1 SV=1, sp|Q1JPB0|ILEU_BOVIN Leukocyte elastase inhibitor OS=Bos taurus OX=9913 GN=SERPINB1 PE=2 SV=2, sp|Q4G075|ILEUA_RAT Leukocyte elastase inhibitor A OS=Rattus norvegicus OX=10116 GN=Serpinb1a PE=1 SV=1, sp|Q5I0S8|ILEU_XENTR Leukocyte elastase inhibitor OS=Xenopus tropicalis OX=8364 GN=serpinb1 PE=2 SV=1, sp|Q5SV42|ILEUC_MOUSE Leukocyte elastase inhibitor C OS=Mus musculus OX=10090 GN=Serpinb1c PE=1 SV=1, sp|Q64118|A1AT_MERUN Alpha-1-antitrypsin OS=Meriones unguiculatus OX=10047 PE=1 SV=1, sp|Q8VHP7|ILEUB_MOUSE Leukocyte elastase inhibitor B OS=Mus musculus OX=10090 GN=Serpinb1b PE=1 SV=1, sp|Q9D154|ILEUA_MOUSE Leukocyte elastase inhibitor A OS=Mus musculus OX=10090 GN=Serpinb1a PE=1 SV=1, sp|Q9TSZ0|ANGT_CALJA Angiotensinogen OS=Callithrix jacchus OX=9483 GN=AGT PE=2 SV=1","tr|A0A023FKT4|A0A023FKT4_AMBCJ Putative serine proteinase inhibitor OS=Amblyomma cajennense OX=34607 PE=2 SV=1, tr|A0A023GAT4|A0A023GAT4_AMBTT Putative tick serpins 42 _Fragment_ OS=Amblyomma triste OX=251400 PE=2 SV=1, tr|A0A023GK55|A0A023GK55_AMBTT Putative tick serpins 31 _Fragment_ OS=Amblyomma triste OX=251400 PE=2 SV=1, tr|G0WS04|G0WS04_RHIMP SeRPin family member OS=Rhipicephalus microplus OX=6941 GN=srp PE=3 SV=1, tr|G3MGC3|G3MGC3_AMBMU SERPIN domain-containing protein _Fragment_ OS=Amblyomma maculatum OX=34609 PE=2 SV=1, tr|G3MPA2|G3MPA2_AMBMU SERPIN domain-containing protein OS=Amblyomma maculatum OX=34609 PE=2 SV=1, tr|K7X6U2|K7X6U2_9ACAR Serpin 2 OS=Rhipicephalus haemaphysaloides OX=237073 PE=2 SV=1, tr|L7LQN0|L7LQN0_RHIPC Putative tick salivary serpin OS=Rhipicephalus pulchellus OX=72859 PE=2 SV=1, tr|L7LRZ2|L7LRZ2_RHIPC Putative tick salivary serpin OS=Rhipicephalus pulchellus OX=72859 PE=2 SV=1, tr|V9VKZ6|V9VKZ6_RHIMP Serine protease inhibitor 1 RmS-1 OS=Rhipicephalus microplus OX=6941 GN=RmS-1 PE=2 SV=1, tr|V9VLM1|V9VLM1_RHIMP Putative serine proteinase inhibitor OS=Rhipicephalus microplus OX=6941 GN=RmS-2 PE=2 SV=1, tr|V9VMN2|V9VMN2_RHIMP Putative serine proteinase inhibitor fat body overexpressed OS=Rhipicephalus microplus OX=6941 GN=RmS-8 PE=2 SV=1, tr|V9VMP1|V9VMP1_RHIMP Putative serine proteinase inhibitor OS=Rhipicephalus microplus OX=6941 GN=RmS-18 PE=2 SV=1","tr|V9VLM1|V9VLM1_RHIMP Putative serine proteinase inhibitor OS=Rhipicephalus microplus OX=6941 GN=RmS-2 PE=2 SV=1, tr|V9VLM1|V9VLM1_RHIMP Putative serine proteinase inhibitor OS=Rhipicephalus microplus OX=6941 GN=RmS-2 PE=2 SV=1, tr|V9VMP1|V9VMP1_RHIMP Putative serine proteinase inhibitor OS=Rhipicephalus microplus OX=6941 GN=RmS-18 PE=2 SV=1, tr|V9VMP1|V9VMP1_RHIMP Putative serine proteinase inhibitor OS=Rhipicephalus microplus OX=6941 GN=RmS-18 PE=2 SV=1","sp|P48594|SPB4_HUMAN Serpin B4 OS=Homo sapiens OX=9606 GN=SERPINB4 PE=1 SV=2, sp|Q1JPB0|ILEU_BOVIN Leukocyte elastase inhibitor OS=Bos taurus OX=9913 GN=SERPINB1 PE=2 SV=2, sp|Q5SV42|ILEUC_MOUSE Leukocyte elastase inhibitor C OS=Mus musculus OX=10090 GN=Serpinb1c PE=1 SV=1, sp|Q9D154|ILEUA_MOUSE Leukocyte elastase inhibitor A OS=Mus musculus OX=10090 GN=Serpinb1a PE=1 SV=1","sp|B4USX2|SPB10_OTOGA Serpin B10 OS=Otolemur garnettii OX=30611 GN=SERPINB10 PE=3 SV=1, sp|P29508|SPB3_HUMAN Serpin B3 OS=Homo sapiens OX=9606 GN=SERPINB3 PE=1 SV=2, sp|P48594|SPB4_HUMAN Serpin B4 OS=Homo sapiens OX=9606 GN=SERPINB4 PE=1 SV=2, sp|P50453|SPB9_HUMAN Serpin B9 OS=Homo sapiens OX=9606 GN=SERPINB9 PE=1 SV=1, sp|Q5I0S8|ILEU_XENTR Leukocyte elastase inhibitor OS=Xenopus tropicalis OX=8364 GN=serpinb1 PE=2 SV=1, sp|Q5SV42|ILEUC_MOUSE Leukocyte elastase inhibitor C OS=Mus musculus OX=10090 GN=Serpinb1c PE=1 SV=1, sp|Q8VHP7|ILEUB_MOUSE Leukocyte elastase inhibitor B OS=Mus musculus OX=10090 GN=Serpinb1b PE=1 SV=1, sp|Q9D154|ILEUA_MOUSE Leukocyte elastase inhibitor A OS=Mus musculus OX=10090 GN=Serpinb1a PE=1 SV=1"
"OG0000007","sp|O00338|ST1C2_HUMAN Sulfotransferase 1C2 OS=Homo sapiens OX=9606 GN=SULT1C2 PE=1 SV=1, sp|O35400|ST2B1_MOUSE Sulfotransferase 2B1 OS=Mus musculus OX=10090 GN=Sult2b1 PE=1 SV=2, sp|O35403|ST3A1_MOUSE Amine sulfotransferase OS=Mus musculus OX=10090 GN=Sult3a1 PE=2 SV=1, sp|O46503|ST1C2_RABIT Sulfotransferase 1C2 OS=Oryctolagus cuniculus OX=9986 GN=SULT1C2 PE=1 SV=1, sp|O46640|ST3A1_RABIT Amine sulfotransferase OS=Oryctolagus cuniculus OX=9986 GN=SULT3A1 PE=1 SV=1, sp|O75897|ST1C4_HUMAN Sulfotransferase 1C4 OS=Homo sapiens OX=9606 GN=SULT1C4 PE=1 SV=2, sp|P19217|ST1E1_BOVIN Sulfotransferase 1E1 OS=Bos taurus OX=9913 GN=SULT1E1 PE=1 SV=1, sp|P22789|ST2A2_RAT Alcohol sulfotransferase A OS=Rattus norvegicus OX=10116 GN=St2a2 PE=1 SV=2, sp|P49888|ST1E1_HUMAN Sulfotransferase 1E1 OS=Homo sapiens OX=9606 GN=SULT1E1 PE=1 SV=1, sp|P49891|ST1E1_MOUSE Sulfotransferase 1E1 OS=Mus musculus OX=10090 GN=Sult1e1 PE=1 SV=2, sp|P50225|ST1A1_HUMAN Sulfotransferase 1A1 OS=Homo sapiens OX=9606 GN=SULT1A1 PE=1 SV=3, sp|P50226|ST1A2_HUMAN Sulfotransferase 1A2 OS=Homo sapiens OX=9606 GN=SULT1A2 PE=1 SV=2, sp|P50234|SUHA_CAVPO 3-alpha-hydroxysteroid sulfotransferase OS=Cavia porcellus OX=10141 GN=STD1 PE=2 SV=2, sp|P52842|ST2A1_MACFA Sulfotransferase 2A1 OS=Macaca fascicularis OX=9541 GN=SULT2A1 PE=1 SV=2, sp|P52843|ST2A1_MOUSE Sulfotransferase 2A1 OS=Mus musculus OX=10090 GN=Sult2a1 PE=1 SV=1, sp|Q29YR5|ST2B1_RAT Sulfotransferase 2B1 OS=Rattus norvegicus OX=10116 GN=Sult2b1 PE=1 SV=1, sp|Q6IMI6|ST1C3_HUMAN Sulfotransferase 1C3 OS=Homo sapiens OX=9606 GN=SULT1C3 PE=1 SV=1, sp|Q95JD5|ST1B1_CANLF Sulfotransferase family cytosolic 1B member 1 OS=Canis lupus familiaris OX=9615 GN=SULT1B1 PE=1 SV=1, sp|Q9D939|ST1C2_MOUSE Sulfotransferase 1C2 OS=Mus musculus OX=10090 GN=Sult1c2 PE=1 SV=1, sp|Q9QWG7|ST1B1_MOUSE Sulfotransferase family cytosolic 1B member 1 OS=Mus musculus OX=10090 GN=Sult1b1 PE=1 SV=2","tr|A0A090XE44|A0A090XE44_IXORI Sulfotransferase family cytosolic 1B member 1 _Fragment_ OS=Ixodes ricinus OX=34613 PE=2 SV=1, tr|B7P491|B7P491_IXOSC Sulfotransferase family cytosolic 1B member 1 OS=Ixodes scapularis OX=6945 GN=8024394 PE=4 SV=1, tr|V5GXA7|V5GXA7_IXORI Putative sulfotransferase _Fragment_ OS=Ixodes ricinus OX=34613 PE=2 SV=1","tr|A0A131YJZ9|A0A131YJZ9_RHIAP Sulfotransferase family cytosolic 1B member 1 OS=Rhipicephalus appendiculatus OX=34631 PE=4 SV=1, tr|A0A131YJZ9|A0A131YJZ9_RHIAP Sulfotransferase family cytosolic 1B member 1 OS=Rhipicephalus appendiculatus OX=34631 PE=4 SV=1","sp|O00338|ST1C2_HUMAN Sulfotransferase 1C2 OS=Homo sapiens OX=9606 GN=SULT1C2 PE=1 SV=1, sp|O46503|ST1C2_RABIT Sulfotransferase 1C2 OS=Oryctolagus cuniculus OX=9986 GN=SULT1C2 PE=1 SV=1, sp|O46640|ST3A1_RABIT Amine sulfotransferase OS=Oryctolagus cuniculus OX=9986 GN=SULT3A1 PE=1 SV=1, sp|Q3UZZ6|ST1D1_MOUSE Sulfotransferase 1 family member D1 OS=Mus musculus OX=10090 GN=Sult1d1 PE=1 SV=1, sp|Q9WUW9|S1C2A_RAT Sulfotransferase 1C2A OS=Rattus norvegicus OX=10116 GN=Sult1c2a PE=2 SV=2","sp|O35400|ST2B1_MOUSE Sulfotransferase 2B1 OS=Mus musculus OX=10090 GN=Sult2b1 PE=1 SV=2, sp|O46503|ST1C2_RABIT Sulfotransferase 1C2 OS=Oryctolagus cuniculus OX=9986 GN=SULT1C2 PE=1 SV=1, sp|O46640|ST3A1_RABIT Amine sulfotransferase OS=Oryctolagus cuniculus OX=9986 GN=SULT3A1 PE=1 SV=1, sp|O75897|ST1C4_HUMAN Sulfotransferase 1C4 OS=Homo sapiens OX=9606 GN=SULT1C4 PE=1 SV=2, sp|P50226|ST1A2_HUMAN Sulfotransferase 1A2 OS=Homo sapiens OX=9606 GN=SULT1A2 PE=1 SV=2, sp|Q9D939|ST1C2_MOUSE Sulfotransferase 1C2 OS=Mus musculus OX=10090 GN=Sult1c2 PE=1 SV=1, sp|Q9QWG7|ST1B1_MOUSE Sulfotransferase family cytosolic 1B member 1 OS=Mus musculus OX=10090 GN=Sult1b1 PE=1 SV=2, sp|Q9WUW9|S1C2A_RAT Sulfotransferase 1C2A OS=Rattus norvegicus OX=10116 GN=Sult1c2a PE=2 SV=2"
"OG0000010","sp|A5UBQ1|DNAK_HAEIE Chaperone protein DnaK OS=Haemophilus influenzae _strain PittEE_ OX=374930 GN=dnaK PE=3 SV=1, sp|C4K3I6|DNAK_HAMD5 Chaperone protein DnaK OS=Hamiltonella defensa subsp. Acyrthosiphon pisum _strain 5AT_ OX=572265 GN=dnaK PE=3 SV=1, sp|P20029|BIP_MOUSE Endoplasmic reticulum chaperone BiP OS=Mus musculus OX=10090 GN=Hspa5 PE=1 SV=3, sp|P41827|HSP74_ANOAL Heat shock protein 70 B2 OS=Anopheles albimanus OX=7167 GN=HSP70B2 PE=3 SV=1, sp|P49118|BIP_SOLLC Luminal-binding protein OS=Solanum lycopersicum OX=4081 PE=2 SV=1, sp|Q00043|HSP70_AJECA Heat shock 70 kDa protein OS=Ajellomyces capsulatus OX=5037 GN=HSP70 PE=3 SV=1, sp|Q5NFG7|DNAK_FRATT Chaperone protein DnaK OS=Francisella tularensis subsp. tularensis _strain SCHU S4 / Schu 4_ OX=177416 GN=dnaK PE=3 SV=1, sp|Q9U639|HSP7D_MANSE Heat shock 70 kDa protein cognate 4 OS=Manduca sexta OX=7130 PE=2 SV=1","tr|A0A023FQ54|A0A023FQ54_AMBCJ Putative heat shock protein _Fragment_ OS=Amblyomma cajennense OX=34607 PE=2 SV=1, tr|A0A023GNY6|A0A023GNY6_AMBTT Putative heat shock protein _Fragment_ OS=Amblyomma triste OX=251400 PE=2 SV=1, tr|G3MF27|G3MF27_AMBMU Uncharacterized protein OS=Amblyomma maculatum OX=34609 PE=2 SV=1, tr|L7LX08|L7LX08_RHIPC Putative molecular chaperones mortalin/pbp74/grp75 hsp70 superfamily OS=Rhipicephalus pulchellus OX=72859 PE=2 SV=1, tr|L7MMF8|L7MMF8_RHIPC Putative heat shock protein 70 _Fragment_ OS=Rhipicephalus pulchellus OX=72859 PE=2 SV=1","tr|A0A034WXE0|A0A034WXE0_RHIMP Heat shock protein 70 1 OS=Rhipicephalus microplus OX=6941 PE=3 SV=1, tr|A0A034WXE0|A0A034WXE0_RHIMP Heat shock protein 70 1 OS=Rhipicephalus microplus OX=6941 PE=3 SV=1, tr|A0A131XQ28|A0A131XQ28_9ACAR Putative heat shock protein _Fragment_ OS=Hyalomma excavatum OX=257692 PE=2 SV=1, tr|A0A131XQ28|A0A131XQ28_9ACAR Putative heat shock protein _Fragment_ OS=Hyalomma excavatum OX=257692 PE=2 SV=1, tr|A0A131YYR4|A0A131YYR4_RHIAP Heat shock 70kDa protein 1/8 OS=Rhipicephalus appendiculatus OX=34631 PE=3 SV=1, tr|A0A131YYR4|A0A131YYR4_RHIAP Heat shock 70kDa protein 1/8 OS=Rhipicephalus appendiculatus OX=34631 PE=3 SV=1, tr|A0A224Z095|A0A224Z095_9ACAR Heat shock 70kDa protein 5 OS=Rhipicephalus zambeziensis OX=60191 PE=3 SV=1, tr|A0A224Z095|A0A224Z095_9ACAR Heat shock 70kDa protein 5 OS=Rhipicephalus zambeziensis OX=60191 PE=3 SV=1, tr|A0A224Z482|A0A224Z482_9ACAR Molecular chaperone DnaK OS=Rhipicephalus zambeziensis OX=60191 PE=3 SV=1, tr|A0A224Z482|A0A224Z482_9ACAR Molecular chaperone DnaK OS=Rhipicephalus zambeziensis OX=60191 PE=3 SV=1, tr|B7PEN4|B7PEN4_IXOSC Heat shock protein_ putative OS=Ixodes scapularis OX=6945 GN=8051659 PE=3 SV=1, tr|B7PEN4|B7PEN4_IXOSC Heat shock protein_ putative OS=Ixodes scapularis OX=6945 GN=8051659 PE=3 SV=1","sp|O97125|HSP68_DROME Heat shock protein 68 OS=Drosophila melanogaster OX=7227 GN=Hsp68 PE=1 SV=1, sp|Q5R511|GRP75_PONAB Stress-70 protein_ mitochondrial OS=Pongo abelii OX=9601 GN=HSPA9 PE=2 SV=1, sp|Q90593|BIP_CHICK Endoplasmic reticulum chaperone BiP OS=Gallus gallus OX=9031 GN=HSPA5 PE=1 SV=1, sp|Q9U639|HSP7D_MANSE Heat shock 70 kDa protein cognate 4 OS=Manduca sexta OX=7130 PE=2 SV=1","sp|O97125|HSP68_DROME Heat shock protein 68 OS=Drosophila melanogaster OX=7227 GN=Hsp68 PE=1 SV=1, sp|P11503|HSP70_ONCVO Heat shock 70 kDa protein _Fragment_ OS=Onchocerca volvulus OX=6282 PE=2 SV=2, sp|P41826|HSP72_ANOAL Heat shock protein 70 A2 OS=Anopheles albimanus OX=7167 GN=HSP70A2 PE=3 SV=1, sp|P41827|HSP74_ANOAL Heat shock protein 70 B2 OS=Anopheles albimanus OX=7167 GN=HSP70B2 PE=3 SV=1, sp|Q5R511|GRP75_PONAB Stress-70 protein_ mitochondrial OS=Pongo abelii OX=9601 GN=HSPA9 PE=2 SV=1, sp|Q90593|BIP_CHICK Endoplasmic reticulum chaperone BiP OS=Gallus gallus OX=9031 GN=HSPA5 PE=1 SV=1, sp|Q9U639|HSP7D_MANSE Heat shock 70 kDa protein cognate 4 OS=Manduca sexta OX=7130 PE=2 SV=1"
"OG0000022","sp|O62761|CHLE_PANTT Cholinesterase OS=Panthera tigris tigris OX=74535 GN=BCHE PE=2 SV=1, sp|P04058|ACES_TETCF Acetylcholinesterase OS=Tetronarce californica OX=7787 GN=ache PE=1 SV=2, sp|P06276|CHLE_HUMAN Cholinesterase OS=Homo sapiens OX=9606 GN=BCHE PE=1 SV=1, sp|P22303|ACES_HUMAN Acetylcholinesterase OS=Homo sapiens OX=9606 GN=ACHE PE=1 SV=1, sp|P23795|ACES_BOVIN Acetylcholinesterase OS=Bos taurus OX=9913 GN=ACHE PE=1 SV=2, sp|P36196|ACES_CHICK Acetylcholinesterase OS=Gallus gallus OX=9031 GN=ACHE PE=2 SV=1, sp|Q27677|ACES_LEPDE Acetylcholinesterase OS=Leptinotarsa decemlineata OX=7539 PE=2 SV=1, sp|Q869C3|ACES_ANOGA Acetylcholinesterase OS=Anopheles gambiae OX=7165 GN=Ace PE=1 SV=3, sp|Q92035|ACES_BUNFA Acetylcholinesterase OS=Bungarus fasciatus OX=8613 GN=ACHE PE=1 SV=2","tr|A0A023GHC7|A0A023GHC7_AMBTT Carboxylic ester hydrolase _Fragment_ OS=Amblyomma triste OX=251400 PE=2 SV=1, tr|B7P3Z1|B7P3Z1_IXOSC Carboxylic ester hydrolase OS=Ixodes scapularis OX=6945 GN=8024262 PE=3 SV=1, tr|B7QL24|B7QL24_IXOSC Carboxylic ester hydrolase OS=Ixodes scapularis OX=6945 GN=8042867 PE=3 SV=1, tr|G3MGI8|G3MGI8_AMBMU Carboxylic ester hydrolase _Fragment_ OS=Amblyomma maculatum OX=34609 PE=2 SV=1, tr|L7MFU7|L7MFU7_RHIPC Carboxylic ester hydrolase _Fragment_ OS=Rhipicephalus pulchellus OX=72859 PE=2 SV=1, tr|O45210|O45210_RHIMP Carboxylic ester hydrolase OS=Rhipicephalus microplus OX=6941 PE=2 SV=1, tr|O61987|O61987_RHIDE Carboxylic ester hydrolase OS=Rhipicephalus decoloratus OX=60189 GN=AChE PE=3 SV=1, tr|Q9U6M8|Q9U6M8_RHIMP Carboxylic ester hydrolase OS=Rhipicephalus microplus OX=6941 GN=EST9 PE=2 SV=1, tr|V5HC40|V5HC40_IXORI Carboxylic ester hydrolase OS=Ixodes ricinus OX=34613 PE=2 SV=1","tr|Q9U6M8|Q9U6M8_RHIMP Carboxylic ester hydrolase OS=Rhipicephalus microplus OX=6941 GN=EST9 PE=2 SV=1, tr|Q9U6M8|Q9U6M8_RHIMP Carboxylic ester hydrolase OS=Rhipicephalus microplus OX=6941 GN=EST9 PE=2 SV=1","sp|O62763|ACES_FELCA Acetylcholinesterase OS=Felis catus OX=9685 GN=ACHE PE=3 SV=1","sp|O62761|CHLE_PANTT Cholinesterase OS=Panthera tigris tigris OX=74535 GN=BCHE PE=2 SV=1, sp|P22303|ACES_HUMAN Acetylcholinesterase OS=Homo sapiens OX=9606 GN=ACHE PE=1 SV=1, sp|Q869C3|ACES_ANOGA Acetylcholinesterase OS=Anopheles gambiae OX=7165 GN=Ace PE=1 SV=3, sp|Q92035|ACES_BUNFA Acetylcholinesterase OS=Bungarus fasciatus OX=8613 GN=ACHE PE=1 SV=2, sp|W4VSJ0|ACES_TRILK Acetylcholinesterase-1 OS=Trittame loki OX=1295018 PE=1 SV=1"
"OG0000024","sp|P0CQ76|DBP2_CRYNJ ATP-dependent RNA helicase DBP2-A OS=Cryptococcus neoformans var. neoformans serotype D _strain JEC21 / ATCC MYA-565_ OX=214684 GN=DBP2 PE=3 SV=1, sp|Q501J6|DDX17_MOUSE Probable ATP-dependent RNA helicase DDX17 OS=Mus musculus OX=10090 GN=Ddx17 PE=1 SV=1, sp|Q61656|DDX5_MOUSE Probable ATP-dependent RNA helicase DDX5 OS=Mus musculus OX=10090 GN=Ddx5 PE=1 SV=2, sp|Q92841|DDX17_HUMAN Probable ATP-dependent RNA helicase DDX17 OS=Homo sapiens OX=9606 GN=DDX17 PE=1 SV=2","tr|A0A023FLZ1|A0A023FLZ1_AMBCJ RNA helicase OS=Amblyomma cajennense OX=34607 PE=2 SV=1, tr|A0A023G7V7|A0A023G7V7_AMBTT RNA helicase _Fragment_ OS=Amblyomma triste OX=251400 PE=2 SV=1, tr|B7P8J4|B7P8J4_IXOSC RNA helicase _Fragment_ OS=Ixodes scapularis OX=6945 GN=8026175 PE=3 SV=1, tr|L7LWK5|L7LWK5_RHIPC RNA helicase OS=Rhipicephalus pulchellus OX=72859 PE=2 SV=1, tr|L7M9P5|L7M9P5_RHIPC RNA helicase OS=Rhipicephalus pulchellus OX=72859 PE=2 SV=1, tr|V5IK42|V5IK42_IXORI RNA helicase OS=Ixodes ricinus OX=34613 PE=2 SV=1","tr|A0A224YI82|A0A224YI82_9ACAR RNA helicase OS=Rhipicephalus zambeziensis OX=60191 PE=3 SV=1, tr|A0A224YI82|A0A224YI82_9ACAR RNA helicase OS=Rhipicephalus zambeziensis OX=60191 PE=3 SV=1, tr|L7LWV3|L7LWV3_RHIPC RNA helicase OS=Rhipicephalus pulchellus OX=72859 PE=2 SV=1, tr|L7LWV3|L7LWV3_RHIPC RNA helicase OS=Rhipicephalus pulchellus OX=72859 PE=2 SV=1","sp|P0CQ76|DBP2_CRYNJ ATP-dependent RNA helicase DBP2-A OS=Cryptococcus neoformans var. neoformans serotype D _strain JEC21 / ATCC MYA-565_ OX=214684 GN=DBP2 PE=3 SV=1, sp|Q4PHU9|DBP2_USTMA ATP-dependent RNA helicase DBP2 OS=Ustilago maydis _strain 521 / FGSC 9021_ OX=237631 GN=DBP2 PE=3 SV=2, sp|Q501J6|DDX17_MOUSE Probable ATP-dependent RNA helicase DDX17 OS=Mus musculus OX=10090 GN=Ddx17 PE=1 SV=1, sp|Q61656|DDX5_MOUSE Probable ATP-dependent RNA helicase DDX5 OS=Mus musculus OX=10090 GN=Ddx5 PE=1 SV=2, sp|Q92841|DDX17_HUMAN Probable ATP-dependent RNA helicase DDX17 OS=Homo sapiens OX=9606 GN=DDX17 PE=1 SV=2","sp|A1C6C4|DBP2_ASPCL ATP-dependent RNA helicase dbp2 OS=Aspergillus clavatus _strain ATCC 1007 / CBS 513.65 / DSM 816 / NCTC 3887 / NRRL 1_ OX=344612 GN=dbp2 PE=3 SV=1, sp|A5DL80|DBP2_PICGU ATP-dependent RNA helicase DBP2 OS=Meyerozyma guilliermondii _strain ATCC 6260 / CBS 566 / DSM 6381 / JCM 1539 / NBRC 10279 / NRRL Y-324_ OX=294746 GN=DBP2 PE=3 SV=3, sp|P17844|DDX5_HUMAN Probable ATP-dependent RNA helicase DDX5 OS=Homo sapiens OX=9606 GN=DDX5 PE=1 SV=1, sp|Q4R6M5|DDX5_MACFA Probable ATP-dependent RNA helicase DDX5 OS=Macaca fascicularis OX=9541 GN=DDX5 PE=2 SV=1, sp|Q501J6|DDX17_MOUSE Probable ATP-dependent RNA helicase DDX17 OS=Mus musculus OX=10090 GN=Ddx17 PE=1 SV=1, sp|Q61656|DDX5_MOUSE Probable ATP-dependent RNA helicase DDX5 OS=Mus musculus OX=10090 GN=Ddx5 PE=1 SV=2, sp|Q92841|DDX17_HUMAN Probable ATP-dependent RNA helicase DDX17 OS=Homo sapiens OX=9606 GN=DDX17 PE=1 SV=2"
"OG0000028","sp|B2RX12|MRP3_MOUSE ATP-binding cassette sub-family C member 3 OS=Mus musculus OX=10090 GN=Abcc3 PE=1 SV=2, sp|O15438|MRP3_HUMAN ATP-binding cassette sub-family C member 3 OS=Homo sapiens OX=9606 GN=ABCC3 PE=1 SV=3, sp|O35379|MRP1_MOUSE Multidrug resistance-associated protein 1 OS=Mus musculus OX=10090 GN=Abcc1 PE=1 SV=1, sp|O88563|MRP3_RAT ATP-binding cassette sub-family C member 3 OS=Rattus norvegicus OX=10116 GN=Abcc3 PE=1 SV=1, sp|P33527|MRP1_HUMAN Multidrug resistance-associated protein 1 OS=Homo sapiens OX=9606 GN=ABCC1 PE=1 SV=3, sp|P91660|L259_DROME Probable multidrug resistance-associated protein lethal_2_03659 OS=Drosophila melanogaster OX=7227 GN=l_2_03659 PE=2 SV=4, sp|Q09428|ABCC8_HUMAN ATP-binding cassette sub-family C member 8 OS=Homo sapiens OX=9606 GN=ABCC8 PE=1 SV=6, sp|Q10185|ABC2_SCHPO ATP-binding cassette transporter abc2 OS=Schizosaccharomyces pombe _strain 972 / ATCC 24843_ OX=284812 GN=abc2 PE=1 SV=1, sp|Q54LE6|ABCC5_DICDI ABC transporter C family member 5 OS=Dictyostelium discoideum OX=44689 GN=abcC5 PE=3 SV=1, sp|Q8HXQ5|MRP1_BOVIN Multidrug resistance-associated protein 1 OS=Bos taurus OX=9913 GN=ABCC1 PE=1 SV=1, sp|Q92337|ABC1_SCHPO ATP-binding cassette transporter abc1 OS=Schizosaccharomyces pombe _strain 972 / ATCC 24843_ OX=284812 GN=abc1 PE=3 SV=1, sp|Q92887|MRP2_HUMAN ATP-binding cassette sub-family C member 2 OS=Homo sapiens OX=9606 GN=ABCC2 PE=1 SV=3, sp|Q9SKX0|AB13C_ARATH ABC transporter C family member 13 OS=Arabidopsis thaliana OX=3702 GN=ABCC13 PE=2 SV=3","tr|A0A023G7I4|A0A023G7I4_AMBTT Putative abc transporter ixodes scapularis abc transporter _Fragment_ OS=Amblyomma triste OX=251400 PE=2 SV=1, tr|A0A023GMC3|A0A023GMC3_AMBTT Putative multidrug resistance-associated protein/mitoxantrone resistance protein abc superfamily OS=Amblyomma triste OX=251400 PE=2 SV=1, tr|B7PDH2|B7PDH2_IXOSC Multidrug resistance protein_ putative OS=Ixodes scapularis OX=6945 GN=8028288 PE=3 SV=1, tr|B7PLA4|B7PLA4_IXOSC ABC transporter_ putative OS=Ixodes scapularis OX=6945 GN=8050868 PE=4 SV=1, tr|L7M973|L7M973_RHIPC Uncharacterized protein OS=Rhipicephalus pulchellus OX=72859 PE=2 SV=1, tr|V5H7R9|V5H7R9_IXORI Putative abc transporter c family member OS=Ixodes ricinus OX=34613 PE=2 SV=1, tr|V5IEP8|V5IEP8_IXORI Putative abc transporter c family member _Fragment_ OS=Ixodes ricinus OX=34613 PE=2 SV=1","tr|L7M973|L7M973_RHIPC Uncharacterized protein OS=Rhipicephalus pulchellus OX=72859 PE=2 SV=1, tr|L7M973|L7M973_RHIPC Uncharacterized protein OS=Rhipicephalus pulchellus OX=72859 PE=2 SV=1","sp|O35379|MRP1_MOUSE Multidrug resistance-associated protein 1 OS=Mus musculus OX=10090 GN=Abcc1 PE=1 SV=1","sp|Q5F364|MRP1_CHICK Multidrug resistance-associated protein 1 OS=Gallus gallus OX=9031 GN=ABCC1 PE=2 SV=1, sp|Q63120|MRP2_RAT ATP-binding cassette sub-family C member 2 OS=Rattus norvegicus OX=10116 GN=Abcc2 PE=1 SV=1"
"OG0000031","sp|P04905|GSTM1_RAT Glutathione S-transferase Mu 1 OS=Rattus norvegicus OX=10116 GN=Gstm1 PE=1 SV=2, sp|P08010|GSTM2_RAT Glutathione S-transferase Mu 2 OS=Rattus norvegicus OX=10116 GN=Gstm2 PE=1 SV=2, sp|P10649|GSTM1_MOUSE Glutathione S-transferase Mu 1 OS=Mus musculus OX=10090 GN=Gstm1 PE=1 SV=2, sp|P16413|GSTM1_CAVPO Glutathione S-transferase B OS=Cavia porcellus OX=10141 GN=GSTM1 PE=1 SV=1, sp|P30116|GSTMU_MESAU Glutathione S-transferase OS=Mesocricetus auratus OX=10036 PE=2 SV=2, sp|P46409|GSTMU_RABIT Glutathione S-transferase Mu 1 OS=Oryctolagus cuniculus OX=9986 PE=1 SV=2, sp|Q9N0V4|GSTM1_BOVIN Glutathione S-transferase Mu 1 OS=Bos taurus OX=9913 GN=GSTM1 PE=1 SV=3","tr|A0A034WXZ4|A0A034WXZ4_RHIMP Glutathione S-transferase 2 _Fragment_ OS=Rhipicephalus microplus OX=6941 PE=4 SV=1, tr|B0LAI9|B0LAI9_9ACAR Glutathione transferase OS=Rhipicephalus annulatus OX=34611 GN=GSTmu PE=2 SV=1, tr|Q6JVM9|Q6JVM9_RHIAP Glutathione transferase OS=Rhipicephalus appendiculatus OX=34631 GN=GST PE=2 SV=1","tr|A0A034WXS6|A0A034WXS6_RHIMP Glutathione transferase OS=Rhipicephalus microplus OX=6941 PE=3 SV=1, tr|A0A034WXS6|A0A034WXS6_RHIMP Glutathione transferase OS=Rhipicephalus microplus OX=6941 PE=3 SV=1, tr|E5L877|E5L877_RHIMP Glutathione transferase OS=Rhipicephalus microplus OX=6941 PE=2 SV=1, tr|E5L877|E5L877_RHIMP Glutathione transferase OS=Rhipicephalus microplus OX=6941 PE=2 SV=1, tr|Q6JVM9|Q6JVM9_RHIAP Glutathione transferase OS=Rhipicephalus appendiculatus OX=34631 GN=GST PE=2 SV=1, tr|Q6JVM9|Q6JVM9_RHIAP Glutathione transferase OS=Rhipicephalus appendiculatus OX=34631 GN=GST PE=2 SV=1","sp|P08010|GSTM2_RAT Glutathione S-transferase Mu 2 OS=Rattus norvegicus OX=10116 GN=Gstm2 PE=1 SV=2, sp|P15626|GSTM2_MOUSE Glutathione S-transferase Mu 2 OS=Mus musculus OX=10090 GN=Gstm2 PE=1 SV=2, sp|P30116|GSTMU_MESAU Glutathione S-transferase OS=Mesocricetus auratus OX=10036 PE=2 SV=2, sp|Q9Z1B2|GSTM5_RAT Glutathione S-transferase Mu 5 OS=Rattus norvegicus OX=10116 GN=Gstm5 PE=1 SV=3","sp|P15626|GSTM2_MOUSE Glutathione S-transferase Mu 2 OS=Mus musculus OX=10090 GN=Gstm2 PE=1 SV=2, sp|P16413|GSTM1_CAVPO Glutathione S-transferase B OS=Cavia porcellus OX=10141 GN=GSTM1 PE=1 SV=1, sp|P30116|GSTMU_MESAU Glutathione S-transferase OS=Mesocricetus auratus OX=10036 PE=2 SV=2, sp|Q9Z1B2|GSTM5_RAT Glutathione S-transferase Mu 5 OS=Rattus norvegicus OX=10116 GN=Gstm5 PE=1 SV=3"
"OG0000034","sp|P81281|TRGS_TACTR 8.6 kDa transglutaminase substrate OS=Tachypleus tridentatus OX=6853 PE=1 SV=1","tr|A0A023G0S7|A0A023G0S7_AMBTT Putative secreted protein OS=Amblyomma triste OX=251400 PE=2 SV=1, tr|A0A023G9T4|A0A023G9T4_AMBTT Putative secreted protein OS=Amblyomma triste OX=251400 PE=2 SV=1, tr|A0A023GC25|A0A023GC25_AMBTT Putative secreted protein OS=Amblyomma triste OX=251400 PE=2 SV=1, tr|A0A034WTW9|A0A034WTW9_RHIMP Putative secreted protein 14 synganglion overexpressed OS=Rhipicephalus microplus OX=6941 PE=4 SV=1, tr|A0A034WXM1|A0A034WXM1_RHIMP Putative insulin-like growth factor binding protein-related protein 6 short OS=Rhipicephalus microplus OX=6941 PE=4 SV=1, tr|B7Q5W0|B7Q5W0_IXOSC Secreted protein_ putative _Fragment_ OS=Ixodes scapularis OX=6945 GN=8036350 PE=4 SV=1, tr|B7Q7H8|B7Q7H8_IXOSC Secreted protein_ putative OS=Ixodes scapularis OX=6945 GN=8037035 PE=4 SV=1, tr|B7QE47|B7QE47_IXOSC Secreted protein_ putative _Fragment_ OS=Ixodes scapularis OX=6945 GN=8039885 PE=4 SV=1, tr|D5LHI6|D5LHI6_AMBAM Insulin-like growth factor binding protein-related protein 6 short OS=Amblyomma americanum OX=6943 PE=2 SV=1, tr|D5LHI7|D5LHI7_AMBAM Insulin-like growth factor binding protein-related protein 6 long OS=Amblyomma americanum OX=6943 PE=2 SV=1, tr|L7M926|L7M926_RHIPC Putative metastriate insulin growth factor binding protein OS=Rhipicephalus pulchellus OX=72859 PE=2 SV=1, tr|L7MC44|L7MC44_RHIPC Putative metastriate insulin growth factor binding protein OS=Rhipicephalus pulchellus OX=72859 PE=2 SV=1, tr|L7MCC3|L7MCC3_RHIPC Putative metastriate insulin growth factor binding protein OS=Rhipicephalus pulchellus OX=72859 PE=2 SV=1, tr|L7MLX8|L7MLX8_RHIPC Putative metastriate insulin growth factor binding protein _Fragment_ OS=Rhipicephalus pulchellus OX=72859 PE=2 SV=1, tr|V5H8K0|V5H8K0_IXORI Putative insulin-like growth factor binding protein-related protein 6 long OS=Ixodes ricinus OX=34613 PE=2 SV=1, tr|V5HBK4|V5HBK4_IXORI Putative secreted protein OS=Ixodes ricinus OX=34613 PE=2 SV=1","tr|A0A034WTW9|A0A034WTW9_RHIMP Putative secreted protein 14 synganglion overexpressed OS=Rhipicephalus microplus OX=6941 PE=4 SV=1, tr|A0A034WTW9|A0A034WTW9_RHIMP Putative secreted protein 14 synganglion overexpressed OS=Rhipicephalus microplus OX=6941 PE=4 SV=1, tr|A0A034WXM1|A0A034WXM1_RHIMP Putative insulin-like growth factor binding protein-related protein 6 short OS=Rhipicephalus microplus OX=6941 PE=4 SV=1, tr|A0A034WXM1|A0A034WXM1_RHIMP Putative insulin-like growth factor binding protein-related protein 6 short OS=Rhipicephalus microplus OX=6941 PE=4 SV=1","sp|P81281|TRGS_TACTR 8.6 kDa transglutaminase substrate OS=Tachypleus tridentatus OX=6853 PE=1 SV=1","sp|P81281|TRGS_TACTR 8.6 kDa transglutaminase substrate OS=Tachypleus tridentatus OX=6853 PE=1 SV=1"
