"Orthogroup","Amblyomma_aureolatum","Rhipicephalus_bursa","Rhipicephalus_microplus","Rhipicephalus_sanguineus","Rhipicephalus_zambeziensis"
"OG0000278","sp|A5A6H9|ODBA_PANTR 2-oxoisovalerate dehydrogenase subunit alpha_ mitochondrial OS=Pan troglodytes OX=9598 GN=BCKDHA PE=2 SV=1, sp|P11960|ODBA_RAT 2-oxoisovalerate dehydrogenase subunit alpha_ mitochondrial _Fragment_ OS=Rattus norvegicus OX=10116 GN=Bckdha PE=1 SV=1","tr|L7LYA6|L7LYA6_RHIPC 2-oxoisovalerate dehydrogenase subunit alpha OS=Rhipicephalus pulchellus OX=72859 PE=2 SV=1, tr|L7MDV3|L7MDV3_RHIPC Putative branched chain alpha-keto acid dehydrogenase complex alpha subunit _Fragment_ OS=Rhipicephalus pulchellus OX=72859 PE=2 SV=1","tr|A0A1E1XQ28|A0A1E1XQ28_9ACAR 2-oxoisovalerate dehydrogenase subunit alpha _Fragment_ OS=Amblyomma sculptum OX=1581419 PE=2 SV=1, tr|A0A1E1XQ28|A0A1E1XQ28_9ACAR 2-oxoisovalerate dehydrogenase subunit alpha _Fragment_ OS=Amblyomma sculptum OX=1581419 PE=2 SV=1, tr|L7MDV3|L7MDV3_RHIPC Putative branched chain alpha-keto acid dehydrogenase complex alpha subunit _Fragment_ OS=Rhipicephalus pulchellus OX=72859 PE=2 SV=1, tr|L7MDV3|L7MDV3_RHIPC Putative branched chain alpha-keto acid dehydrogenase complex alpha subunit _Fragment_ OS=Rhipicephalus pulchellus OX=72859 PE=2 SV=1","sp|P50136|ODBA_MOUSE 2-oxoisovalerate dehydrogenase subunit alpha_ mitochondrial OS=Mus musculus OX=10090 GN=Bckdha PE=1 SV=1","sp|P11960|ODBA_RAT 2-oxoisovalerate dehydrogenase subunit alpha_ mitochondrial _Fragment_ OS=Rattus norvegicus OX=10116 GN=Bckdha PE=1 SV=1"
"OG0000279","sp|A0JZ10|FTHS_ARTS2 Formate--tetrahydrofolate ligase OS=Arthrobacter sp. _strain FB24_ OX=290399 GN=fhs PE=3 SV=1, sp|A5UPV2|FTHS_ROSS1 Formate--tetrahydrofolate ligase OS=Roseiflexus sp. _strain RS-1_ OX=357808 GN=fhs PE=3 SV=1, sp|O96553|C1TC_DROME C-1-tetrahydrofolate synthase_ cytoplasmic OS=Drosophila melanogaster OX=7227 GN=pug PE=2 SV=4, sp|Q3V3R1|C1TM_MOUSE Monofunctional C1-tetrahydrofolate synthase_ mitochondrial OS=Mus musculus OX=10090 GN=Mthfd1l PE=1 SV=2","tr|A0A090XDT2|A0A090XDT2_IXORI Formyltetrahydrofolate synthetase _Fragment_ OS=Ixodes ricinus OX=34613 PE=2 SV=1, tr|L7MCX5|L7MCX5_RHIPC Formyltetrahydrofolate synthetase _Fragment_ OS=Rhipicephalus pulchellus OX=72859 PE=2 SV=1","tr|A0A131YL25|A0A131YL25_RHIAP Formyltetrahydrofolate synthetase OS=Rhipicephalus appendiculatus OX=34631 PE=3 SV=1, tr|A0A131YL25|A0A131YL25_RHIAP Formyltetrahydrofolate synthetase OS=Rhipicephalus appendiculatus OX=34631 PE=3 SV=1","sp|O96553|C1TC_DROME C-1-tetrahydrofolate synthase_ cytoplasmic OS=Drosophila melanogaster OX=7227 GN=pug PE=2 SV=4","sp|P27653|C1TC_RAT C-1-tetrahydrofolate synthase_ cytoplasmic OS=Rattus norvegicus OX=10116 GN=Mthfd1 PE=1 SV=3"
"OG0000281","sp|Q8IUS5|EPHX4_HUMAN Epoxide hydrolase 4 OS=Homo sapiens OX=9606 GN=EPHX4 PE=1 SV=2","tr|G3MFA2|G3MFA2_AMBMU AB hydrolase-1 domain-containing protein _Fragment_ OS=Amblyomma maculatum OX=34609 PE=2 SV=1, tr|L7M282|L7M282_RHIPC Putative soluble epoxide hydrolase OS=Rhipicephalus pulchellus OX=72859 PE=2 SV=1, tr|V5ICU9|V5ICU9_IXORI Putative soluble epoxide hydrolase OS=Ixodes ricinus OX=34613 PE=2 SV=1","tr|L7M282|L7M282_RHIPC Putative soluble epoxide hydrolase OS=Rhipicephalus pulchellus OX=72859 PE=2 SV=1, tr|L7M282|L7M282_RHIPC Putative soluble epoxide hydrolase OS=Rhipicephalus pulchellus OX=72859 PE=2 SV=1","sp|Q8IUS5|EPHX4_HUMAN Epoxide hydrolase 4 OS=Homo sapiens OX=9606 GN=EPHX4 PE=1 SV=2","sp|Q0IIS3|EPHX3_XENTR Epoxide hydrolase 3 OS=Xenopus tropicalis OX=8364 GN=ephx3 PE=2 SV=1, sp|Q6IE26|EPHX4_MOUSE Epoxide hydrolase 4 OS=Mus musculus OX=10090 GN=Ephx4 PE=2 SV=2, sp|Q8IUS5|EPHX4_HUMAN Epoxide hydrolase 4 OS=Homo sapiens OX=9606 GN=EPHX4 PE=1 SV=2"
"OG0000282","sp|Q66KC4|HSDL2_XENTR Hydroxysteroid dehydrogenase-like protein 2 OS=Xenopus tropicalis OX=8364 GN=hsdl2 PE=2 SV=1, sp|Q6P5L8|HSDL2_DANRE Hydroxysteroid dehydrogenase-like protein 2 OS=Danio rerio OX=7955 GN=hsdl2 PE=2 SV=1","tr|A0A023FDJ4|A0A023FDJ4_AMBCJ Putative hydroxysteroid dehydrogenase-like protein 2 _Fragment_ OS=Amblyomma cajennense OX=34607 PE=2 SV=1, tr|B7PKM5|B7PKM5_IXOSC Short-chain dehydrogenase_ putative _Fragment_ OS=Ixodes scapularis OX=6945 GN=8052987 PE=3 SV=1, tr|L7MKN4|L7MKN4_RHIPC Putative hydroxysteroid dehydrogenase-like protein 2 _Fragment_ OS=Rhipicephalus pulchellus OX=72859 PE=2 SV=1","tr|A0A224YZ89|A0A224YZ89_9ACAR Hydroxysteroid dehydrogenase like protein 2 OS=Rhipicephalus zambeziensis OX=60191 PE=3 SV=1, tr|A0A224YZ89|A0A224YZ89_9ACAR Hydroxysteroid dehydrogenase like protein 2 OS=Rhipicephalus zambeziensis OX=60191 PE=3 SV=1","sp|Q6P5L8|HSDL2_DANRE Hydroxysteroid dehydrogenase-like protein 2 OS=Danio rerio OX=7955 GN=hsdl2 PE=2 SV=1","sp|Q6P5L8|HSDL2_DANRE Hydroxysteroid dehydrogenase-like protein 2 OS=Danio rerio OX=7955 GN=hsdl2 PE=2 SV=1, sp|Q6PAY8|HSDL2_XENLA Hydroxysteroid dehydrogenase-like protein 2 OS=Xenopus laevis OX=8355 GN=hsdl2 PE=2 SV=1"
"OG0000283","sp|Q9UKU7|ACAD8_HUMAN Isobutyryl-CoA dehydrogenase_ mitochondrial OS=Homo sapiens OX=9606 GN=ACAD8 PE=1 SV=1","tr|B7PJR8|B7PJR8_IXOSC Medium-chain acyl-CoA dehydrogenase_ putative OS=Ixodes scapularis OX=6945 GN=8029989 PE=3 SV=1, tr|L7M0N6|L7M0N6_RHIPC Uncharacterized protein OS=Rhipicephalus pulchellus OX=72859 PE=2 SV=1, tr|L7M8C4|L7M8C4_RHIPC Uncharacterized protein OS=Rhipicephalus pulchellus OX=72859 PE=2 SV=1","tr|A0A131X8G7|A0A131X8G7_9ACAR Putative short chain acyl-coa dehydrogen OS=Hyalomma excavatum OX=257692 PE=2 SV=1, tr|A0A131X8G7|A0A131X8G7_9ACAR Putative short chain acyl-coa dehydrogen OS=Hyalomma excavatum OX=257692 PE=2 SV=1","sp|Q9D7B6|ACAD8_MOUSE Isobutyryl-CoA dehydrogenase_ mitochondrial OS=Mus musculus OX=10090 GN=Acad8 PE=1 SV=2, sp|Q9UKU7|ACAD8_HUMAN Isobutyryl-CoA dehydrogenase_ mitochondrial OS=Homo sapiens OX=9606 GN=ACAD8 PE=1 SV=1","sp|Q9D7B6|ACAD8_MOUSE Isobutyryl-CoA dehydrogenase_ mitochondrial OS=Mus musculus OX=10090 GN=Acad8 PE=1 SV=2, sp|Q9UKU7|ACAD8_HUMAN Isobutyryl-CoA dehydrogenase_ mitochondrial OS=Homo sapiens OX=9606 GN=ACAD8 PE=1 SV=1"
"OG0000284","sp|P16354|PA23_HELSU Phospholipase A2 isozymes PA3A/PA3B/PA5 OS=Heloderma suspectum OX=8554 PE=1 SV=3, sp|P80003|PA2A2_HELSU Acidic phospholipase A2 PA4 OS=Heloderma suspectum OX=8554 PE=1 SV=2","tr|A0A034WWL8|A0A034WWL8_RHIMP Phospholipase A_2_ OS=Rhipicephalus microplus OX=6941 PE=4 SV=1, tr|B7QGM5|B7QGM5_IXOSC Phospholipase A_2_ _Fragment_ OS=Ixodes scapularis OX=6945 GN=8040958 PE=4 SV=1, tr|V5H8N1|V5H8N1_IXORI Phospholipase A_2_ OS=Ixodes ricinus OX=34613 PE=2 SV=1","tr|A0A034WWL8|A0A034WWL8_RHIMP Phospholipase A_2_ OS=Rhipicephalus microplus OX=6941 PE=4 SV=1, tr|A0A034WWL8|A0A034WWL8_RHIMP Phospholipase A_2_ OS=Rhipicephalus microplus OX=6941 PE=4 SV=1","sp|P80003|PA2A2_HELSU Acidic phospholipase A2 PA4 OS=Heloderma suspectum OX=8554 PE=1 SV=2","sp|P80003|PA2A2_HELSU Acidic phospholipase A2 PA4 OS=Heloderma suspectum OX=8554 PE=1 SV=2, sp|Q7M4I6|PA2_BOMPE Phospholipase A2 OS=Bombus pensylvanicus OX=28643 PE=1 SV=1"
"OG0000286","sp|Q8VDJ3|VIGLN_MOUSE Vigilin OS=Mus musculus OX=10090 GN=Hdlbp PE=1 SV=1","tr|B7Q368|B7Q368_IXOSC High-density lipoprotein-binding protein_ putative OS=Ixodes scapularis OX=6945 GN=8035203 PE=4 SV=1, tr|V5HQC5|V5HQC5_IXORI Putative vigilin OS=Ixodes ricinus OX=34613 PE=2 SV=1","tr|A0A131XMK3|A0A131XMK3_9ACAR Putative vigilin _Fragment_ OS=Hyalomma excavatum OX=257692 PE=2 SV=1, tr|A0A131XMK3|A0A131XMK3_9ACAR Putative vigilin _Fragment_ OS=Hyalomma excavatum OX=257692 PE=2 SV=1, tr|A0A1E1XLZ9|A0A1E1XLZ9_9ACAR Putative vigilin OS=Amblyomma sculptum OX=1581419 PE=2 SV=1, tr|A0A1E1XLZ9|A0A1E1XLZ9_9ACAR Putative vigilin OS=Amblyomma sculptum OX=1581419 PE=2 SV=1","sp|P81021|VIGLN_CHICK Vigilin OS=Gallus gallus OX=9031 GN=HDLBP PE=2 SV=1, sp|Q8VDJ3|VIGLN_MOUSE Vigilin OS=Mus musculus OX=10090 GN=Hdlbp PE=1 SV=1","sp|Q8VDJ3|VIGLN_MOUSE Vigilin OS=Mus musculus OX=10090 GN=Hdlbp PE=1 SV=1"
"OG0000287","sp|P56542|DNS2A_MOUSE Deoxyribonuclease-2-alpha OS=Mus musculus OX=10090 GN=Dnase2 PE=1 SV=1, sp|Q75WF2|DNA2_ACAPL Plancitoxin-1 OS=Acanthaster planci OX=133434 PE=1 SV=1","tr|A0A034WXS2|A0A034WXS2_RHIMP Deoxyribonuclease II 1 OS=Rhipicephalus microplus OX=6941 PE=3 SV=1, tr|A0A090X952|A0A090X952_IXORI Putative lpxtg-motif cell wall anchor domain-containing protein OS=Ixodes ricinus OX=34613 PE=2 SV=1","tr|A0A224YN00|A0A224YN00_9ACAR Deoxyribonuclease II OS=Rhipicephalus zambeziensis OX=60191 PE=3 SV=1, tr|A0A224YN00|A0A224YN00_9ACAR Deoxyribonuclease II OS=Rhipicephalus zambeziensis OX=60191 PE=3 SV=1","sp|Q75WF2|DNA2_ACAPL Plancitoxin-1 OS=Acanthaster planci OX=133434 PE=1 SV=1","sp|Q75WF2|DNA2_ACAPL Plancitoxin-1 OS=Acanthaster planci OX=133434 PE=1 SV=1, sp|Q8WZ79|DNS2B_HUMAN Deoxyribonuclease-2-beta OS=Homo sapiens OX=9606 GN=DNASE2B PE=2 SV=1, sp|Q9QY48|DNS2B_MOUSE Deoxyribonuclease-2-beta OS=Mus musculus OX=10090 GN=Dnase2b PE=2 SV=1"
"OG0000289","sp|O42131|TOP2B_CHICK DNA topoisomerase 2-beta OS=Gallus gallus OX=9031 GN=TOP2B PE=2 SV=1","tr|B7P0P1|B7P0P1_IXOSC DNA topoisomerase 2 OS=Ixodes scapularis OX=6945 GN=8023133 PE=3 SV=1, tr|L7MAX8|L7MAX8_RHIPC DNA topoisomerase 2 _Fragment_ OS=Rhipicephalus pulchellus OX=72859 PE=2 SV=1, tr|V5H3F2|V5H3F2_IXORI DNA topoisomerase 2 OS=Ixodes ricinus OX=34613 PE=2 SV=1","tr|A0A224YLC8|A0A224YLC8_9ACAR DNA topoisomerase 2 OS=Rhipicephalus zambeziensis OX=60191 PE=3 SV=1, tr|A0A224YLC8|A0A224YLC8_9ACAR DNA topoisomerase 2 OS=Rhipicephalus zambeziensis OX=60191 PE=3 SV=1, tr|B7P0P1|B7P0P1_IXOSC DNA topoisomerase 2 OS=Ixodes scapularis OX=6945 GN=8023133 PE=3 SV=1, tr|B7P0P1|B7P0P1_IXOSC DNA topoisomerase 2 OS=Ixodes scapularis OX=6945 GN=8023133 PE=3 SV=1","sp|O42130|TOP2A_CHICK DNA topoisomerase 2-alpha OS=Gallus gallus OX=9031 GN=TOP2A PE=2 SV=2","sp|O42130|TOP2A_CHICK DNA topoisomerase 2-alpha OS=Gallus gallus OX=9031 GN=TOP2A PE=2 SV=2"
"OG0000290","sp|Q9VCA9|SPCS3_DROME Signal peptidase complex subunit 3 OS=Drosophila melanogaster OX=7227 GN=Spase22-23 PE=2 SV=1","tr|A0A023FML8|A0A023FML8_AMBCJ Putative signal peptidase complex subunit _Fragment_ OS=Amblyomma cajennense OX=34607 PE=2 SV=1, tr|A0A023FUZ4|A0A023FUZ4_AMBPA Putative signal peptidase complex subunit _Fragment_ OS=Amblyomma parvum OX=251391 PE=2 SV=1, tr|C9W1S4|C9W1S4_RHISA Signal peptidase _Fragment_ OS=Rhipicephalus sanguineus OX=34632 PE=2 SV=1","tr|C9W1S4|C9W1S4_RHISA Signal peptidase _Fragment_ OS=Rhipicephalus sanguineus OX=34632 PE=2 SV=1, tr|C9W1S4|C9W1S4_RHISA Signal peptidase _Fragment_ OS=Rhipicephalus sanguineus OX=34632 PE=2 SV=1, tr|G3MHA6|G3MHA6_AMBMU Uncharacterized protein _Fragment_ OS=Amblyomma maculatum OX=34609 PE=2 SV=1, tr|G3MHA6|G3MHA6_AMBMU Uncharacterized protein _Fragment_ OS=Amblyomma maculatum OX=34609 PE=2 SV=1","sp|Q9VCA9|SPCS3_DROME Signal peptidase complex subunit 3 OS=Drosophila melanogaster OX=7227 GN=Spase22-23 PE=2 SV=1","sp|Q9VCA9|SPCS3_DROME Signal peptidase complex subunit 3 OS=Drosophila melanogaster OX=7227 GN=Spase22-23 PE=2 SV=1"
"OG0000291","sp|P53992|SC24C_HUMAN Protein transport protein Sec24C OS=Homo sapiens OX=9606 GN=SEC24C PE=1 SV=3","tr|A0A023GCD9|A0A023GCD9_AMBTT Putative vesicle coat complex copii subunit sfb3 _Fragment_ OS=Amblyomma triste OX=251400 PE=2 SV=1, tr|L7M023|L7M023_RHIPC Putative vesicle coat complex copii subunit sec24/subunit sfb2 OS=Rhipicephalus pulchellus OX=72859 PE=2 SV=1, tr|L7M0U9|L7M0U9_RHIPC Putative vesicle coat complex copii subunit sec24/subunit sfb2 OS=Rhipicephalus pulchellus OX=72859 PE=2 SV=1","tr|L7M0U9|L7M0U9_RHIPC Putative vesicle coat complex copii subunit sec24/subunit sfb2 OS=Rhipicephalus pulchellus OX=72859 PE=2 SV=1, tr|L7M0U9|L7M0U9_RHIPC Putative vesicle coat complex copii subunit sec24/subunit sfb2 OS=Rhipicephalus pulchellus OX=72859 PE=2 SV=1, tr|V5HC92|V5HC92_IXORI Putative vesicle coat complex copii subunit sec24/subunit sfb2 _Fragment_ OS=Ixodes ricinus OX=34613 PE=2 SV=1, tr|V5HC92|V5HC92_IXORI Putative vesicle coat complex copii subunit sec24/subunit sfb2 _Fragment_ OS=Ixodes ricinus OX=34613 PE=2 SV=1","sp|P53992|SC24C_HUMAN Protein transport protein Sec24C OS=Homo sapiens OX=9606 GN=SEC24C PE=1 SV=3","sp|P53992|SC24C_HUMAN Protein transport protein Sec24C OS=Homo sapiens OX=9606 GN=SEC24C PE=1 SV=3"
"OG0000292","sp|Q4R5L5|ANXA7_MACFA Annexin A7 OS=Macaca fascicularis OX=9541 GN=ANXA7 PE=2 SV=1","tr|A0A023GNS1|A0A023GNS1_AMBTT Annexin OS=Amblyomma triste OX=251400 PE=2 SV=1, tr|L7MHF3|L7MHF3_RHIPC Annexin _Fragment_ OS=Rhipicephalus pulchellus OX=72859 PE=2 SV=1, tr|L7MLR0|L7MLR0_RHIPC Annexin _Fragment_ OS=Rhipicephalus pulchellus OX=72859 PE=2 SV=1","tr|A0A023FX57|A0A023FX57_AMBPA Annexin _Fragment_ OS=Amblyomma parvum OX=251391 PE=2 SV=1, tr|A0A023FX57|A0A023FX57_AMBPA Annexin _Fragment_ OS=Amblyomma parvum OX=251391 PE=2 SV=1, tr|A0A224YTN6|A0A224YTN6_9ACAR Annexin OS=Rhipicephalus zambeziensis OX=60191 PE=3 SV=1, tr|A0A224YTN6|A0A224YTN6_9ACAR Annexin OS=Rhipicephalus zambeziensis OX=60191 PE=3 SV=1","sp|P20072|ANXA7_BOVIN Annexin A7 OS=Bos taurus OX=9913 GN=ANXA7 PE=1 SV=2","sp|P09525|ANXA4_HUMAN Annexin A4 OS=Homo sapiens OX=9606 GN=ANXA4 PE=1 SV=4"
"OG0000293","sp|P26885|FKBP2_HUMAN Peptidyl-prolyl cis-trans isomerase FKBP2 OS=Homo sapiens OX=9606 GN=FKBP2 PE=1 SV=2, sp|Q5R941|FKB14_PONAB Peptidyl-prolyl cis-trans isomerase FKBP14 OS=Pongo abelii OX=9601 GN=FKBP14 PE=2 SV=1","tr|L7M243|L7M243_RHIPC Peptidylprolyl isomerase OS=Rhipicephalus pulchellus OX=72859 PE=2 SV=1, tr|L7M6Y7|L7M6Y7_RHIPC Peptidylprolyl isomerase OS=Rhipicephalus pulchellus OX=72859 PE=2 SV=1","tr|L7M6Y7|L7M6Y7_RHIPC Peptidylprolyl isomerase OS=Rhipicephalus pulchellus OX=72859 PE=2 SV=1, tr|L7M6Y7|L7M6Y7_RHIPC Peptidylprolyl isomerase OS=Rhipicephalus pulchellus OX=72859 PE=2 SV=1","sp|P26885|FKBP2_HUMAN Peptidyl-prolyl cis-trans isomerase FKBP2 OS=Homo sapiens OX=9606 GN=FKBP2 PE=1 SV=2, sp|Q5RET2|FKBP7_PONAB Peptidyl-prolyl cis-trans isomerase FKBP7 OS=Pongo abelii OX=9601 GN=FKBP7 PE=2 SV=1","sp|O54998|FKBP7_MOUSE Peptidyl-prolyl cis-trans isomerase FKBP7 OS=Mus musculus OX=10090 GN=Fkbp7 PE=1 SV=1, sp|P26885|FKBP2_HUMAN Peptidyl-prolyl cis-trans isomerase FKBP2 OS=Homo sapiens OX=9606 GN=FKBP2 PE=1 SV=2"
"OG0000294","sp|P25867|UBCD1_DROME Ubiquitin-conjugating enzyme E2-17 kDa OS=Drosophila melanogaster OX=7227 GN=eff PE=1 SV=1, sp|P62840|UB2D2_XENLA Ubiquitin-conjugating enzyme E2 D2 OS=Xenopus laevis OX=8355 GN=ube2d2 PE=1 SV=1, sp|Q8S920|UBC5A_ORYSJ Ubiquitin-conjugating enzyme E2 5A OS=Oryza sativa subsp. japonica OX=39947 GN=UBC5A PE=2 SV=1","tr|A0A023GF12|A0A023GF12_AMBTT Putative effete OS=Amblyomma triste OX=251400 PE=2 SV=1, tr|L7M3Y2|L7M3Y2_RHIPC Putative ubiquitin-protein ligase OS=Rhipicephalus pulchellus OX=72859 PE=2 SV=1","tr|A0A131Y4L1|A0A131Y4L1_IXORI Putative ubiquitin-protein ligase OS=Ixodes ricinus OX=34613 PE=2 SV=1, tr|A0A131Y4L1|A0A131Y4L1_IXORI Putative ubiquitin-protein ligase OS=Ixodes ricinus OX=34613 PE=2 SV=1","sp|P25867|UBCD1_DROME Ubiquitin-conjugating enzyme E2-17 kDa OS=Drosophila melanogaster OX=7227 GN=eff PE=1 SV=1","sp|P25867|UBCD1_DROME Ubiquitin-conjugating enzyme E2-17 kDa OS=Drosophila melanogaster OX=7227 GN=eff PE=1 SV=1, sp|Q8S920|UBC5A_ORYSJ Ubiquitin-conjugating enzyme E2 5A OS=Oryza sativa subsp. japonica OX=39947 GN=UBC5A PE=2 SV=1"
"OG0000296","sp|P61314|RL15_RAT 60S ribosomal protein L15 OS=Rattus norvegicus OX=10116 GN=Rpl15 PE=1 SV=2, sp|Q7T3P1|RL15_ANGJA 60S ribosomal protein L15 OS=Anguilla japonica OX=7937 GN=rpl15 PE=2 SV=3","tr|E2J6X9|E2J6X9_9ACAR Ribosomal protein L15 _Fragment_ OS=Hyalomma rufipes OX=72862 PE=2 SV=1, tr|Q4PM43|Q4PM43_IXOSC Ribosomal protein L15 OS=Ixodes scapularis OX=6945 GN=8030599 PE=2 SV=1","tr|A0A023FJ95|A0A023FJ95_AMBCJ Ribosomal protein L15 OS=Amblyomma cajennense OX=34607 PE=2 SV=1, tr|A0A023FJ95|A0A023FJ95_AMBCJ Ribosomal protein L15 OS=Amblyomma cajennense OX=34607 PE=2 SV=1, tr|G3MML2|G3MML2_AMBMU Ribosomal protein L15 OS=Amblyomma maculatum OX=34609 PE=2 SV=1, tr|G3MML2|G3MML2_AMBMU Ribosomal protein L15 OS=Amblyomma maculatum OX=34609 PE=2 SV=1","sp|Q7T3P1|RL15_ANGJA 60S ribosomal protein L15 OS=Anguilla japonica OX=7937 GN=rpl15 PE=2 SV=3","sp|Q7T3P1|RL15_ANGJA 60S ribosomal protein L15 OS=Anguilla japonica OX=7937 GN=rpl15 PE=2 SV=3"
"OG0000297","sp|O16797|RL3_DROME 60S ribosomal protein L3 OS=Drosophila melanogaster OX=7227 GN=RpL3 PE=1 SV=3, sp|Q8NKF4|RL3_ASPFU 60S ribosomal protein L3 OS=Neosartorya fumigata _strain ATCC MYA-4609 / Af293 / CBS 101355 / FGSC A1100_ OX=330879 GN=rpl3 PE=1 SV=2","tr|A0A023FJ23|A0A023FJ23_AMBCJ Putative ribosomal protein _Fragment_ OS=Amblyomma cajennense OX=34607 PE=2 SV=1, tr|A0A023FL87|A0A023FL87_AMBCJ Putative ribosomal protein _Fragment_ OS=Amblyomma cajennense OX=34607 PE=2 SV=1","tr|A0A224Z2T5|A0A224Z2T5_9ACAR Large subunit ribosomal protein L3e OS=Rhipicephalus zambeziensis OX=60191 PE=3 SV=1, tr|A0A224Z2T5|A0A224Z2T5_9ACAR Large subunit ribosomal protein L3e OS=Rhipicephalus zambeziensis OX=60191 PE=3 SV=1","sp|O16797|RL3_DROME 60S ribosomal protein L3 OS=Drosophila melanogaster OX=7227 GN=RpL3 PE=1 SV=3","sp|O16797|RL3_DROME 60S ribosomal protein L3 OS=Drosophila melanogaster OX=7227 GN=RpL3 PE=1 SV=3, sp|P39872|RL3_BOVIN 60S ribosomal protein L3 OS=Bos taurus OX=9913 GN=RPL3 PE=2 SV=2, sp|P49149|RL3_TOXCA 60S ribosomal protein L3 OS=Toxocara canis OX=6265 GN=RPL3 PE=2 SV=2"
"OG0000298","sp|P56192|SYMC_HUMAN Methionine--tRNA ligase_ cytoplasmic OS=Homo sapiens OX=9606 GN=MARS1 PE=1 SV=2, sp|Q6PF21|SYMC_XENLA Methionine--tRNA ligase_ cytoplasmic OS=Xenopus laevis OX=8355 GN=mars1 PE=2 SV=1","tr|A0A023FL89|A0A023FL89_AMBCJ Methionine--tRNA ligase_ cytoplasmic _Fragment_ OS=Amblyomma cajennense OX=34607 PE=2 SV=1, tr|B7PAR2|B7PAR2_IXOSC Methionine--tRNA ligase_ cytoplasmic _Fragment_ OS=Ixodes scapularis OX=6945 GN=8027105 PE=3 SV=1, tr|G3MHK0|G3MHK0_AMBMU Methionine--tRNA ligase_ cytoplasmic _Fragment_ OS=Amblyomma maculatum OX=34609 PE=2 SV=1, tr|L7MGL4|L7MGL4_RHIPC Methionine--tRNA ligase_ cytoplasmic _Fragment_ OS=Rhipicephalus pulchellus OX=72859 PE=2 SV=1","tr|A0A224YV86|A0A224YV86_9ACAR Methionine--tRNA ligase_ cytoplasmic OS=Rhipicephalus zambeziensis OX=60191 PE=3 SV=1, tr|A0A224YV86|A0A224YV86_9ACAR Methionine--tRNA ligase_ cytoplasmic OS=Rhipicephalus zambeziensis OX=60191 PE=3 SV=1","sp|Q6PF21|SYMC_XENLA Methionine--tRNA ligase_ cytoplasmic OS=Xenopus laevis OX=8355 GN=mars1 PE=2 SV=1","sp|Q6PF21|SYMC_XENLA Methionine--tRNA ligase_ cytoplasmic OS=Xenopus laevis OX=8355 GN=mars1 PE=2 SV=1"
"OG0000300","sp|P83609|BMTIA_RHIMP Kunitz-type serine protease inhibitor A _Fragments_ OS=Rhipicephalus microplus OX=6941 PE=1 SV=2, sp|P84875|PCPI_SABMA Carboxypeptidase inhibitor SmCI OS=Sabellastarte magnifica OX=389514 PE=1 SV=1","tr|A0A034WTW0|A0A034WTW0_RHIMP Kunitz domain-containing protein 1 OS=Rhipicephalus microplus OX=6941 PE=4 SV=1, tr|B7PG23|B7PG23_IXOSC Serine proteinase inhibitor_ putative OS=Ixodes scapularis OX=6945 GN=8052824 PE=4 SV=1, tr|B7QCW4|B7QCW4_IXOSC Serine protease inhibitor_ putative _Fragment_ OS=Ixodes scapularis OX=6945 GN=8039356 PE=4 SV=1","tr|A0A034WTW0|A0A034WTW0_RHIMP Kunitz domain-containing protein 1 OS=Rhipicephalus microplus OX=6941 PE=4 SV=1, tr|A0A034WTW0|A0A034WTW0_RHIMP Kunitz domain-containing protein 1 OS=Rhipicephalus microplus OX=6941 PE=4 SV=1","sp|P83609|BMTIA_RHIMP Kunitz-type serine protease inhibitor A _Fragments_ OS=Rhipicephalus microplus OX=6941 PE=1 SV=2","sp|P83609|BMTIA_RHIMP Kunitz-type serine protease inhibitor A _Fragments_ OS=Rhipicephalus microplus OX=6941 PE=1 SV=2, sp|P84875|PCPI_SABMA Carboxypeptidase inhibitor SmCI OS=Sabellastarte magnifica OX=389514 PE=1 SV=1"
"OG0000302","sp|Q6RVG2|S4A8_RAT Electroneutral sodium bicarbonate exchanger 1 OS=Rattus norvegicus OX=10116 GN=Slc4a8 PE=1 SV=1, sp|Q6U841|S4A10_HUMAN Sodium-driven chloride bicarbonate exchanger OS=Homo sapiens OX=9606 GN=SLC4A10 PE=1 SV=1, sp|Q80ZA5|S4A10_RAT Sodium-driven chloride bicarbonate exchanger OS=Rattus norvegicus OX=10116 GN=Slc4a10 PE=1 SV=1","tr|A0A023GDH6|A0A023GDH6_AMBTT Anion exchange protein _Fragment_ OS=Amblyomma triste OX=251400 PE=2 SV=1, tr|L7MK92|L7MK92_RHIPC Anion exchange protein _Fragment_ OS=Rhipicephalus pulchellus OX=72859 PE=2 SV=1, tr|V5H8Y5|V5H8Y5_IXORI Putative na +-driven anion exchanger 1 OS=Ixodes ricinus OX=34613 PE=2 SV=1","tr|A0A131YUB6|A0A131YUB6_RHIAP Anion exchange protein OS=Rhipicephalus appendiculatus OX=34631 PE=3 SV=1, tr|A0A131YUB6|A0A131YUB6_RHIAP Anion exchange protein OS=Rhipicephalus appendiculatus OX=34631 PE=3 SV=1","sp|Q6U841|S4A10_HUMAN Sodium-driven chloride bicarbonate exchanger OS=Homo sapiens OX=9606 GN=SLC4A10 PE=1 SV=1","sp|Q6U841|S4A10_HUMAN Sodium-driven chloride bicarbonate exchanger OS=Homo sapiens OX=9606 GN=SLC4A10 PE=1 SV=1"
"OG0000305","sp|P54647|VATA_DICDI V-type proton ATPase catalytic subunit A OS=Dictyostelium discoideum OX=44689 GN=vatA PE=1 SV=2, sp|Q2TJ56|VATA_AEDAL V-type proton ATPase catalytic subunit A OS=Aedes albopictus OX=7160 GN=VhaA PE=2 SV=1","tr|A0A023FJZ6|A0A023FJZ6_AMBCJ H_+_-transporting two-sector ATPase OS=Amblyomma cajennense OX=34607 PE=2 SV=1, tr|L7MA55|L7MA55_RHIPC H_+_-transporting two-sector ATPase OS=Rhipicephalus pulchellus OX=72859 PE=2 SV=1","tr|A0A131XDB2|A0A131XDB2_9ACAR H_+_-transporting two-sector ATPase OS=Hyalomma excavatum OX=257692 PE=2 SV=1, tr|A0A131XDB2|A0A131XDB2_9ACAR H_+_-transporting two-sector ATPase OS=Hyalomma excavatum OX=257692 PE=2 SV=1, tr|A0A224Z3G3|A0A224Z3G3_9ACAR H_+_-transporting two-sector ATPase OS=Rhipicephalus zambeziensis OX=60191 PE=3 SV=1, tr|A0A224Z3G3|A0A224Z3G3_9ACAR H_+_-transporting two-sector ATPase OS=Rhipicephalus zambeziensis OX=60191 PE=3 SV=1","sp|Q2TJ56|VATA_AEDAL V-type proton ATPase catalytic subunit A OS=Aedes albopictus OX=7160 GN=VhaA PE=2 SV=1","sp|Q2TJ56|VATA_AEDAL V-type proton ATPase catalytic subunit A OS=Aedes albopictus OX=7160 GN=VhaA PE=2 SV=1"
"OG0000306","sp|P08169|MPRI_BOVIN Cation-independent mannose-6-phosphate receptor OS=Bos taurus OX=9913 GN=IGF2R PE=1 SV=2, sp|Q07113|MPRI_MOUSE Cation-independent mannose-6-phosphate receptor OS=Mus musculus OX=10090 GN=Igf2r PE=1 SV=1","tr|A0A023FP26|A0A023FP26_AMBCJ Uncharacterized protein _Fragment_ OS=Amblyomma cajennense OX=34607 PE=2 SV=1, tr|A0A023GPI1|A0A023GPI1_AMBTT Uncharacterized protein _Fragment_ OS=Amblyomma triste OX=251400 PE=2 SV=1, tr|B7QN48|B7QN48_IXOSC Mannose-6-phosphate/insulin receptor type II_ putative OS=Ixodes scapularis OX=6945 GN=8043753 PE=4 SV=1, tr|L7M250|L7M250_RHIPC Putative mannose-6-phosphate/insulin receptor type ii OS=Rhipicephalus pulchellus OX=72859 PE=2 SV=1","tr|A0A224YRP0|A0A224YRP0_9ACAR Insulin-like growth factor 2 receptor OS=Rhipicephalus zambeziensis OX=60191 PE=4 SV=1, tr|A0A224YRP0|A0A224YRP0_9ACAR Insulin-like growth factor 2 receptor OS=Rhipicephalus zambeziensis OX=60191 PE=4 SV=1","sp|Q07113|MPRI_MOUSE Cation-independent mannose-6-phosphate receptor OS=Mus musculus OX=10090 GN=Igf2r PE=1 SV=1","sp|P11717|MPRI_HUMAN Cation-independent mannose-6-phosphate receptor OS=Homo sapiens OX=9606 GN=IGF2R PE=1 SV=3"
"OG0000307","sp|Q28C74|LPPRC_XENTR Leucine-rich PPR motif-containing protein_ mitochondrial OS=Xenopus tropicalis OX=8364 GN=lrpprc PE=2 SV=1, sp|Q5SGE0|LPPRC_RAT Leucine-rich PPR motif-containing protein_ mitochondrial OS=Rattus norvegicus OX=10116 GN=Lrpprc PE=1 SV=1","tr|L7MDG5|L7MDG5_RHIPC Putative leucine-rich ppr-motif protein _Fragment_ OS=Rhipicephalus pulchellus OX=72859 PE=2 SV=1, tr|L7MEF0|L7MEF0_RHIPC Putative leucine-rich ppr-motif protein _Fragment_ OS=Rhipicephalus pulchellus OX=72859 PE=2 SV=1, tr|L7MEF8|L7MEF8_RHIPC Putative leucine-rich ppr-motif protein _Fragment_ OS=Rhipicephalus pulchellus OX=72859 PE=2 SV=1, tr|V5HPA4|V5HPA4_IXORI Putative leucine-rich ppr motif-containing protein _Fragment_ OS=Ixodes ricinus OX=34613 PE=2 SV=1","tr|A0A224YSJ3|A0A224YSJ3_9ACAR Leucine-rich PPR motif-containing protein mitochondrial OS=Rhipicephalus zambeziensis OX=60191 PE=4 SV=1, tr|A0A224YSJ3|A0A224YSJ3_9ACAR Leucine-rich PPR motif-containing protein mitochondrial OS=Rhipicephalus zambeziensis OX=60191 PE=4 SV=1","sp|Q28C74|LPPRC_XENTR Leucine-rich PPR motif-containing protein_ mitochondrial OS=Xenopus tropicalis OX=8364 GN=lrpprc PE=2 SV=1","sp|Q28C74|LPPRC_XENTR Leucine-rich PPR motif-containing protein_ mitochondrial OS=Xenopus tropicalis OX=8364 GN=lrpprc PE=2 SV=1"
"OG0000309","sp|O75643|U520_HUMAN U5 small nuclear ribonucleoprotein 200 kDa helicase OS=Homo sapiens OX=9606 GN=SNRNP200 PE=1 SV=2, sp|Q55CI8|HELCL_DICDI Activating signal cointegrator 1 complex subunit 3-like OS=Dictyostelium discoideum OX=44689 GN=ascc3l PE=3 SV=1","tr|A0A023GME8|A0A023GME8_AMBTT Putative rna helicase brr2 dead-box superfamily OS=Amblyomma triste OX=251400 PE=2 SV=1, tr|L7M5R0|L7M5R0_RHIPC Putative dna/rna helicase mer3/slh1 dead-box superfamily OS=Rhipicephalus pulchellus OX=72859 PE=2 SV=1","tr|B7PL00|B7PL00_IXOSC Antiviral helicase Slh1_ putative OS=Ixodes scapularis OX=6945 GN=8053092 PE=3 SV=1, tr|B7PL00|B7PL00_IXOSC Antiviral helicase Slh1_ putative OS=Ixodes scapularis OX=6945 GN=8053092 PE=3 SV=1, tr|L7M5R0|L7M5R0_RHIPC Putative dna/rna helicase mer3/slh1 dead-box superfamily OS=Rhipicephalus pulchellus OX=72859 PE=2 SV=1, tr|L7M5R0|L7M5R0_RHIPC Putative dna/rna helicase mer3/slh1 dead-box superfamily OS=Rhipicephalus pulchellus OX=72859 PE=2 SV=1","sp|O75643|U520_HUMAN U5 small nuclear ribonucleoprotein 200 kDa helicase OS=Homo sapiens OX=9606 GN=SNRNP200 PE=1 SV=2","sp|O75643|U520_HUMAN U5 small nuclear ribonucleoprotein 200 kDa helicase OS=Homo sapiens OX=9606 GN=SNRNP200 PE=1 SV=2"
